"location","source","target","id","developer_comments"
"01a_04600.bin.json:277","04600:277","初めて疑問符の抑揚のない口調から、問うようにわたしへ呼び掛けた。わたしは、彼女へあの目で視てほしいと言った。共感覚を持つ、朱の目で。","04600:277",""
"01a_04600.bin.json:278","04600:278","それは……。","04600:278",""
"01a_04600.bin.json:280","04600:280","わたしが、わたしの気持ちが本当だってことを知ってほしいんです！","04600:280",""
"01a_04600.bin.json:283","04600:283","躊躇い戸惑うも、着物の袖で顔を隠すようにして――……","04600:283",""
"01a_04600.bin.json:285","04600:285","佐和良義宝珠は朱の眼を晒したのだ。","04600:285",""
"01a_04600.bin.json:287","04600:287","初めはメイに掛けられた冤罪を晴らすために訪れました。その時から素敵な人だなって、親身になって助けてくれる素敵な人だなって思ったんです！","04600:287",""
"01a_04600.bin.json:290","04600:290","そう……なの。","04600:290",""
"01a_04600.bin.json:293","04600:293","木野さんのときにも助けて貰いました！　誤解を解いてくれて……本当に宝珠先輩はわたしにとってなくてはならない天使なんです！","04600:293",""
"01a_04600.bin.json:296","04600:296","朱の眼にはわたしの偽らざる気持ちが映っているのだろう、生気のなかった顔つきは少しずつ色を成していった。","04600:296",""
"01a_04600.bin.json:298","04600:298","マラソン大会のときにも手当をして貰って、そのときに……ええと、そのときではなくて、教室で……。","04600:298",""
"01a_04600.bin.json:300","04600:300","寝ている宝珠先輩へ告白したことを思いだし、恥ずかしさから口を閉ざした。","04600:300",""
"01a_04600.bin.json:302","04600:302","ぁ……。","04600:302",""
"01a_04600.bin.json:304","04600:304","隠そうとする気持ちが見えたのか、表情を幾分曇らせた。宝珠先輩にそんな顔をさせるのは嫌だけれど……今のでさらに確信を得たのだ。","04600:304",""
"01a_04600.bin.json:305","04600:305","宝珠先輩は、お母さんのことが信じられなくて、期待されてないなら、それなら身をひこうかと思っているんですよね？","04600:305",""
"01a_04600.bin.json:308","04600:308","そして身をひくなら、茶道からも離れたいと……。だから茶道部を閉めるという気持ちは変わらない。","04600:308",""
"01a_04600.bin.json:311","04600:311","……[#]そうよ。生徒会からの勧告もちょうどいい機会だと思った。","04600:311",""
"01a_04600.bin.json:313","04600:313","なら、とわたしは続ける。","04600:313",""
"01a_04600.bin.json:315","04600:315","そうであるなら、宝珠先輩の考えは間違いです。茶道部を閉めることも、後継者から退くこともない。","04600:315",""
"01a_04600.bin.json:317","04600:317","え……？","04600:317",""
"01a_04600.bin.json:319","04600:319","あのとき――。","04600:319",""
"01a_04600.bin.json:322","04600:322","お披露目式での、幼い佐和良義宝珠が目にする共感覚での真実。","04600:322",""
"01a_04600.bin.json:324","04600:324","[b]『……まだ不器用なら可愛げがあったが』[k]","04600:324",""
"01a_04600.bin.json:326","04600:326","[b]『なまじ才能があるだけ不憫よな……』[k]","04600:326",""
"01a_04600.bin.json:327","04600:327","それらの嘲りの色は正しかったのだろう。","04600:327",""
"01a_04600.bin.json:328","04600:328","しかし、","04600:328",""
"01a_04600.bin.json:329","04600:329","“そんな目ならば無ければ良かったのに”。","04600:329",""
"01a_04600.bin.json:332","04600:332","……[#]やめて。","04600:332",""
"01a_04600.bin.json:334","04600:334","確かに宝珠先輩の母親はそう言ったのかもしれない。でも、","04600:334",""
"01a_04600.bin.json:337","04600:337","……[#]確かに、","04600:337",""
"01a_04600.bin.json:339","04600:339","わたしの頭の斜め上を、どこか遠くの陰を覗くように、","04600:339",""
"01a_04600.bin.json:340","04600:340","確かに、母はそう告げた。声の色は赤。怒りと憎しみの色だった……。失敗した私へ彩った偽らざる色……。","04600:340",""
"01a_04600.bin.json:342","04600:342","肺から絞り出すように告げる。わたしは項垂れる彼女を目に、それは違うと言う。","04600:342",""
"01a_04600.bin.json:343","04600:343","違う……？　何を――。","04600:343",""
"01a_04600.bin.json:346","04600:346","これもさっき話した悪戯の手紙と同じです。真実だけど真実ではない。","04600:346",""
"01a_04600.bin.json:348","04600:348","わたしは朱の眼をしっかりと見詰め、全身全霊をもって伝える。","04600:348",""
"01a_04600.bin.json:349","04600:349","宝珠先輩の母親の言葉に嘘はなかった。それは本当です。","04600:349",""
"01a_04600.bin.json:352","04600:352","だったら――！","04600:352",""
"01a_04600.bin.json:354","04600:354","いいえ、“そんな目ならば無ければ良かったのに”。","04600:354",""
"01a_04600.bin.json:356","04600:356","告げる言葉に俯き耳を塞ぐ。わたしは彼女の手を掴み無理やりに眼と目を合わせた。揺れる瞳と揺らがない瞳。","04600:356",""
"01a_04600.bin.json:358","04600:358","この言葉は宝珠先輩に向けた言葉ではない。これは、この怒りに満ちた言葉は、“自分の娘に心ない言葉を吐いた面々に告げた言葉”です。","04600:358",""
"01a_04600.bin.json:360","04600:360","娘の赤い目を非難する彼等へ、そんな節穴のような目ならば――“そんな目が無ければ良かったのに”と。","04600:360",""
"01a_04600.bin.json:363","04600:363","揺らいでいた朱い瞳がじょじょに定まり、嘘、と呟いた。","04600:363",""
"01a_04600.bin.json:365","04600:365","だって、私の眼には――。","04600:365",""
"01a_04600.bin.json:367","04600:367","怒りを意味する“赤い色”ですよね？　それは当然です、娘に対する暴言に怒っていたのだから。","04600:367",""
"01a_04600.bin.json:370","04600:370","……[#]私は、私は……思い違いをしていたの……？","04600:370",""
"01a_04600.bin.json:372","04600:372","はい。","04600:372",""
"01a_04600.bin.json:374","04600:374","私は……母を、その日から避けて……。","04600:374",""
"01a_04600.bin.json:376","04600:376","二人とも行き違いをしていたんです。佐和良義流の後継者の話も、辛い思いをしている娘へこれ以上、重荷を背負わせるかどうかを考えていたから――。","04600:376",""
"01a_04600.bin.json:379","04600:379","どうして、と呟いた。何故、それほどに分かるのかと。","04600:379",""
"01a_04600.bin.json:381","04600:381","宝珠先輩のような共感覚の瞳はありませんけど……ずっと、見ていたから分かります。お茶を点てる貴女はとても愉しそうで、凛として、どこか寂しげだったから。","04600:381",""
"01a_04600.bin.json:383","04600:383","アリス……。","04600:383",""
"01a_04600.bin.json:387","04600:387","滲む赤い瞳を見たわたしは堪らなくなり、宝珠先輩を抱きしめた。肩は細く、華奢な身体……。幼い彼女を連想するように。","04600:387",""
"01a_04600.bin.json:388","04600:388","私は……ずっと……母になんて詫びたらいいのか……。","04600:388",""
"01a_04600.bin.json:390","04600:390","勘違いをしていたと話したら――きっと、笑って許してくれます。","04600:390",""
"01a_04600.bin.json:392","04600:392","でも……。","04600:392",""
"01a_04600.bin.json:395","04600:395","ふっと脳裏へ仲が良かった頃の家族の像が浮かぶ。姉を連れて出て行った父。","04600:395",""
"01a_04600.bin.json:396","04600:396","わたしみたいに、","04600:396",""
"01a_04600.bin.json:397","04600:397","そうだ。わたしみたいに――","04600:397",""
"01a_04600.bin.json:399","04600:399","――諦めることなんてない。ずっと頑張っていたのをお母さんはちゃんと見ています。子供を嫌いな親なんている訳がない。","04600:399",""
"01a_04600.bin.json:402","04600:402","アリス……！","04600:402",""
"01a_04600.bin.json:404","04600:404","滲む瞳から涙がこぼれ、頬を伝い流れ落ちていく。","04600:404",""
"01a_04600.bin.json:405","04600:405","夕映えに照らされた涙は美しく、心から許し{絆/ほだ}された印のよう思えた。","04600:405",""
"01a_04600.bin.json:406","04600:406","心を奮わせ泣く彼女へ、わたしは頬を寄せ、自分の温もりで大切な人を癒やすために抱きしめ続けた。","04600:406",""
"01a_04600.bin.json:407","04600:407","小さく啜り泣く声は、負の感情ではなく、それは嬉しさを交えたものに思えた。","04600:407",""
"01a_04600.bin.json:408","04600:408","佐和良義宝珠の涙は、{干天/かんてん}に降る{慈雨/じう}のようにわたしの心も充たしていった。","04600:408",""
"01a_04600.bin.json:409","04600:409","それは無防備な姿で眠っていた茜色に染まったあの教室の中のように。","04600:409",""
"01a_04600.bin.json:410","04600:410","……[#]わたしは、貴女にもうひとつ伝えなくてはいけません。","04600:410",""
"01a_04600.bin.json:413","04600:413","眠っている貴女へわたしは告白をしました。メイに抱いている気持ちとも違う。友情や尊敬だけじゃない、もっと違う気持ちに――。","04600:413",""
"01a_04600.bin.json:417","04600:417","わたしは……わたしは、佐和良義宝珠のことが好きです。とても深く。心が張り裂けてしまうほどに……！","04600:417",""
"01a_04600.bin.json:419","04600:419","喉をつかえながら、胸が破裂してしまいそうになりながら伝える。彼女は――……","04600:419",""
"01a_04600.bin.json:421","04600:421","――――ええ。私もよ。気がついたらずっと貴女ばかりを視ていた。","04600:421",""
"01a_04600.bin.json:423","04600:423","朱く美しい瞳で見詰め、薄く、否、にっこりと大輪の花のように笑ってくれたのだ。","04600:423",""
"01a_04600.bin.json:424","04600:424","――宝珠。","04600:424",""
"01a_04600.bin.json:427","04600:427","名を呼び、額へと口付けた。","04600:427",""
"01a_04600.bin.json:429","04600:429","その瞬間に――神田アリスの周りからあらゆる音が消えてしまった。","04600:429",""
"01a_04600.bin.json:430","04600:430","時間が止まり、其処に存在するのはわたしと彼女だけ。","04600:430",""
"01a_04600.bin.json:431","04600:431","分かち難く混じり合った二人の心には――朱の瞳はもう必要なかった。","04600:431",""
"01a_04600.bin.json:432","04600:432","まっさらな正直な気持ちは、手に取って触れられるように確かだったのだから。","04600:432",""
"01a_04600.bin.json:433","04600:433","何色にも表現できない愛。","04600:433",""
"01a_04600.bin.json:434","04600:434","神田アリスと佐和良義宝珠は、二人の間にある其の色をただ愛おしく抱きしめていた。","04600:434",""
"01a_04600.bin.json:435","04600:435","きっとそれはずっと続くことでしょう。","04600:435",""
"01a_04600.bin.json:436","04600:436","それだけは確かなことなのです――。","04600:436",""
