"location","source","target","id","fuzzy","context","translator_comments","developer_comments"
"01a_02000.bin.json:3","二章","二章","02000:003","False","","",""
"01a_02000.bin.json:5","[b]アリス","[b]アリス","02000:005","False","","",""
"01a_02000.bin.json:6","[b]彼女から連想するのは波紋さえもない静かな湖面[k]","[b]彼女から連想するのは波紋さえもない静かな湖面[k]","02000:006","False","","","爱丽丝"
"01a_02000.bin.json:9","[b]ピアノの前の彼女は、透き通った緊張と[k]","[b]ピアノの前の彼女は、透き通った緊張と[k]","02000:009","False","","","爱丽丝"
"01a_02000.bin.json:12","[b]研ぎ澄まされた集中を水のヴェールのように纏う[k]","[b]研ぎ澄まされた集中を水のヴェールのように纏う[k]","02000:012","False","","","爱丽丝"
"01a_02000.bin.json:15","[b]その場にはピアノと彼女だけ[k]","[b]その場にはピアノと彼女だけ[k]","02000:015","False","","","爱丽丝"
"01a_02000.bin.json:18","[b]けれど、[k]","[b]けれど、[k]","02000:018","False","","","爱丽丝"
"01a_02000.bin.json:21","[b]静かな水面へ風紋がさざ波のように広がり、[k]","[b]静かな水面へ風紋がさざ波のように広がり、[k]","02000:021","False","","","爱丽丝"
"01a_02000.bin.json:24","[b]ピアノと少女との二人だけの世界を[k]","[b]ピアノと少女との二人だけの世界を[k]","02000:024","False","","","爱丽丝"
"01a_02000.bin.json:27","[b]奪ってしまったら――……[k]","[b]奪ってしまったら――……[k]","02000:027","False","","","爱丽丝"
"01a_02000.bin.json:30","[b]これから紡がれるのは――[k]","[b]これから紡がれるのは――[k]","02000:030","False","","","爱丽丝"
"01a_02000.bin.json:33","[b]損なわれし者たちのお話[k]","[b]損なわれし者たちのお話[k]","02000:033","False","","","爱丽丝"
"01a_02000.bin.json:36","弓道部を辞めて思うのは気が引けるけれど、どうやら茶道部が性に合っていたらしい。","弓道部を辞めて思うのは気が引けるけれど、どうやら茶道部が性に合っていたらしい。","02000:036","False","","",""
"01a_02000.bin.json:40","何やってるの、と背を叩かれ、意識せず茶杓で抹茶を入れる動作をイメージトレーニングしていた事実に気付いたほどに。","何やってるの、と背を叩かれ、意識せず茶杓で抹茶を入れる動作をイメージトレーニングしていた事実に気付いたほどに。","02000:040","False","","",""
"01a_02000.bin.json:43","アリス","アリス","02000:043","False","","",""
"01a_02000.bin.json:44","部活動の練習。入ったばかりだから自主練してたのかも。","部活動の練習。入ったばかりだから自主練してたのかも。","02000:044","False","","","爱丽丝"
"01a_02000.bin.json:46","してたのかも？　面白い言い方をするね、と鞄を自分の机の上に置きわたしへと笑いかける。","してたのかも？　面白い言い方をするね、と鞄を自分の机の上に置きわたしへと笑いかける。","02000:046","False","","",""
"01a_02000.bin.json:48","春日","春日","02000:048","False","","",""
"01a_02000.bin.json:49","茶道部だっけ？　まさか入部するなんて思わなかったよ。","茶道部だっけ？　まさか入部するなんて思わなかったよ。","02000:049","False","","","春日"
"01a_02000.bin.json:51","――そう。随分昔のことに思えるけれど弓道部を退部し、茶道部に入部して１０日になる。","――そう。随分昔のことに思えるけれど弓道部を退部し、茶道部に入部して１０日になる。","02000:051","False","","",""
"01a_02000.bin.json:52","ただ作法に則ってお茶を淹れるだけと思っていたけど、作法ひとつひとつにしても色々な示唆が含まれていて面白い。","ただ作法に則ってお茶を淹れるだけと思っていたけど、作法ひとつひとつにしても色々な示唆が含まれていて面白い。","02000:052","False","","",""
"01a_02000.bin.json:53","弓道部の方が似合ってた？","弓道部の方が似合ってた？","02000:053","False","","","爱丽丝"
"01a_02000.bin.json:55","う～ん。どっちかって言うと神田さんは……見た目は茶道部の方が合ってるかな。運動部ってタイプじゃないっていうか。","う～ん。どっちかって言うと神田さんは……見た目は茶道部の方が合ってるかな。運動部ってタイプじゃないっていうか。","02000:055","False","","","春日"
"01a_02000.bin.json:58","これでも１年生の中ではそれなりに期待されてたんだよ？","これでも１年生の中ではそれなりに期待されてたんだよ？","02000:058","False","","","爱丽丝"
"01a_02000.bin.json:62","分かってる、と言い肩を叩く。気易い態度が嬉しい。","分かってる、と言い肩を叩く。気易い態度が嬉しい。","02000:062","False","","",""
"01a_02000.bin.json:64","でも何で弓道部を辞めて、茶道部に入り直したの？　困っていたことは解決したんでしょ。","でも何で弓道部を辞めて、茶道部に入り直したの？　困っていたことは解決したんでしょ。","02000:064","False","","","春日"
"01a_02000.bin.json:66","え？　解決したって話したっけ？","え？　解決したって話したっけ？","02000:066","False","","","爱丽丝"
"01a_02000.bin.json:68","明るい顔になっていたから上手くいったんだなぁって。あ、言い辛いことなら言わなくていいよ。","明るい顔になっていたから上手くいったんだなぁって。あ、言い辛いことなら言わなくていいよ。","02000:068","False","","","春日"
"01a_02000.bin.json:71","良く見てくれているのだな、と嬉しくなったわたしはううんと頭を振り、","良く見てくれているのだな、と嬉しくなったわたしはううんと頭を振り、","02000:071","False","","",""
"01a_02000.bin.json:72","メイが疑われていた事はぼやかしつつ、弓道部で困っていたアレコレは、茶道部の先輩によって解決したのだと言った。","メイが疑われていた事はぼやかしつつ、弓道部で困っていたアレコレは、茶道部の先輩によって解決したのだと言った。","02000:072","False","","",""
"01a_02000.bin.json:74","へぇ、私の噂話も少しは役にたったんだ。","へぇ、私の噂話も少しは役にたったんだ。","02000:074","False","","","春日"
"01a_02000.bin.json:77","すごく役立ったよ！　ありがとう春日さん！","すごく役立ったよ！　ありがとう春日さん！","02000:077","False","","","爱丽丝"
"01a_02000.bin.json:79","ふふ、どういたしまして。それで噂の魔女はどんな感じの人だったの？","ふふ、どういたしまして。それで噂の魔女はどんな感じの人だったの？","02000:079","False","","","春日"
"01a_02000.bin.json:81","魔女？","魔女？","02000:081","False","","","爱丽丝"
"01a_02000.bin.json:84","あれ？　占い師だったかな？　何でもピタリとあてるすごい美人だって噂だったけど。","あれ？　占い師だったかな？　何でもピタリとあてるすごい美人だって噂だったけど。","02000:084","False","","","春日"
"01a_02000.bin.json:86","――そういえば、“占い師”は春日さんから聞いたことだった。","――そういえば、“占い師”は春日さんから聞いたことだった。","02000:086","False","","",""
"01a_02000.bin.json:88","『だからわたしも佐和良義先輩のことを占い師だって思ってたし』","『だからわたしも佐和良義先輩のことを占い師だって思ってたし』","02000:088","False","","","爱丽丝"
"01a_02000.bin.json:90","今となっては探偵みたいだなって思っているけれど……。","今となっては探偵みたいだなって思っているけれど……。","02000:090","False","","",""
"01a_02000.bin.json:91","神田さん？","神田さん？","02000:091","False","","","春日"
"01a_02000.bin.json:94","え、ああ！　すごい美人だよ！　佐和良義先輩って言って、着物が似合う美人さんなんだ。見とれちゃうくらいの！","え、ああ！　すごい美人だよ！　佐和良義先輩って言って、着物が似合う美人さんなんだ。見とれちゃうくらいの！","02000:094","False","","","爱丽丝"
"01a_02000.bin.json:96","そんなに？　それって神田さんより美人なの？","そんなに？　それって神田さんより美人なの？","02000:096","False","","","春日"
"01a_02000.bin.json:98","え？　と、何を言われていたのか分からなくなる。ようやく、からかわれていることが分かり――","え？　と、何を言われていたのか分からなくなる。ようやく、からかわれていることが分かり――","02000:098","False","","",""
"01a_02000.bin.json:99","もう、冗談ばかり！","もう、冗談ばかり！","02000:099","False","","","爱丽丝"
"01a_02000.bin.json:101","と怒った風に言った。","と怒った風に言った。","02000:101","False","","",""
"01a_02000.bin.json:102","……[#]冗談を言ったつもりはなかったんだけどなぁ。","……[#]冗談を言ったつもりはなかったんだけどなぁ。","02000:102","False","","","春日"
"01a_02000.bin.json:105","呟き声に聞き取れなかったわたしは、何？　と問うも頭を振って何でもないと答える。","呟き声に聞き取れなかったわたしは、何？　と問うも頭を振って何でもないと答える。","02000:105","False","","",""
"01a_02000.bin.json:106","そういえば残念だったね。","そういえば残念だったね。","02000:106","False","","","春日"
"01a_02000.bin.json:108","え？","え？","02000:108","False","","","爱丽丝"
"01a_02000.bin.json:110","伴奏者に選ばれなくって。","伴奏者に選ばれなくって。","02000:110","False","","","春日"
"01a_02000.bin.json:113","言われ昨日のことだ、と頭を振った。","言われ昨日のことだ、と頭を振った。","02000:113","False","","",""
"01a_02000.bin.json:115","小さい頃にピアノを少しかじってただけだから。逆に選ばれなくって良かったよ。","小さい頃にピアノを少しかじってただけだから。逆に選ばれなくって良かったよ。","02000:115","False","","","爱丽丝"
"01a_02000.bin.json:117","ふふ、小さい頃って、今も小さいのに。","ふふ、小さい頃って、今も小さいのに。","02000:117","False","","","春日"
"01a_02000.bin.json:119","身長のことは話してないよねぇ！","身長のことは話してないよねぇ！","02000:119","False","","","爱丽丝"
"01a_02000.bin.json:121","抗議すると笑いながらごめん、と手を合わせた。でも、そうか――","抗議すると笑いながらごめん、と手を合わせた。でも、そうか――","02000:121","False","","",""
"01a_02000.bin.json:122","『佐和良義先輩も参加するのかな？』","『佐和良義先輩も参加するのかな？』","02000:122","False","","","爱丽丝"
"01a_02000.bin.json:124","想像ができないわたしは首を傾げ、眉を掻いたのだ。","想像ができないわたしは首を傾げ、眉を掻いたのだ。","02000:124","False","","",""
"01a_02000.bin.json:127","――合唱祭？","――合唱祭？","02000:127","False","","",""
"01a_02000.bin.json:128","と、軽い戸惑いを込め佐和良義先輩は首を傾げた。","と、軽い戸惑いを込め佐和良義先輩は首を傾げた。","02000:128","False","","",""
"01a_02000.bin.json:129","合唱祭ですよ。全校生徒参加だから佐和良義先輩のクラスも出るんですよね。","合唱祭ですよ。全校生徒参加だから佐和良義先輩のクラスも出るんですよね。","02000:129","False","","","爱丽丝"
"01a_02000.bin.json:131","今朝方、級友と話していたときにふと思い浮かべた疑問がわき、部の先輩でもある佐和良義先輩へそう質問したのである。","今朝方、級友と話していたときにふと思い浮かべた疑問がわき、部の先輩でもある佐和良義先輩へそう質問したのである。","02000:131","False","","",""
"01a_02000.bin.json:134","宝珠","宝珠","02000:134","False","","",""
"01a_02000.bin.json:135","……[#]合唱祭。","……[#]合唱祭。","02000:135","False","","","宝珠"
"01a_02000.bin.json:137","再度、不思議そうに呟く彼女へもしかして参加しないのかもとあの時と同じく思った。","再度、不思議そうに呟く彼女へもしかして参加しないのかもとあの時と同じく思った。","02000:137","False","","",""
"01a_02000.bin.json:138","『何か佐和良義先輩が、クラスの皆と一緒に歌うのって想像できないもんね……』","『何か佐和良義先輩が、クラスの皆と一緒に歌うのって想像できないもんね……』","02000:138","False","","","爱丽丝"
"01a_02000.bin.json:140","講堂で皆に交じって歌っているのを妄想しようとしたけれど、やっぱり上手くいかない。","講堂で皆に交じって歌っているのを妄想しようとしたけれど、やっぱり上手くいかない。","02000:140","False","","",""
"01a_02000.bin.json:141","メイ＠？？？","メイ＠？？？","02000:141","False","","",""
"01a_02000.bin.json:142","もしかして伴奏とか指揮者をするとかなら、歌唱する側にはまわってないってことじゃないの？","もしかして伴奏とか指揮者をするとかなら、歌唱する側にはまわってないってことじゃないの？","02000:142","False","","","小明"
"01a_02000.bin.json:144","休憩の際に出すおやつを手に、キッチンから戻ってきた穂高明が言った。","休憩の際に出すおやつを手に、キッチンから戻ってきた穂高明が言った。","02000:144","False","","",""
"01a_02000.bin.json:145","そう、","そう、","02000:145","False","","",""
"01a_02000.bin.json:147","メイ","メイ","02000:147","False","","",""
"01a_02000.bin.json:148","先輩どうぞ！　あ、こっちはアリスの分ね。で、これはあたしの。","先輩どうぞ！　あ、こっちはアリスの分ね。で、これはあたしの。","02000:148","False","","","小明"
"01a_02000.bin.json:151","おやつをそれぞれに手際よく分ける幼馴染みは――わたしと同じく茶道部へ入部したのである。","おやつをそれぞれに手際よく分ける幼馴染みは――わたしと同じく茶道部へ入部したのである。","02000:151","False","","",""
"01a_02000.bin.json:153","あ、先輩の方は多く取り分けましたからね！","あ、先輩の方は多く取り分けましたからね！","02000:153","False","","","小明"
"01a_02000.bin.json:156","ふふ、有り難う。","ふふ、有り難う。","02000:156","False","","","宝珠"
"01a_02000.bin.json:158","まだ入部して１０日だというのに随分と仲が良さげなのだ。","まだ入部して１０日だというのに随分と仲が良さげなのだ。","02000:158","False","","",""
"01a_02000.bin.json:160","『……[#]メイが入部するって言うからっていうのもあるけど』","『……[#]メイが入部するって言うからっていうのもあるけど』","02000:160","False","","","爱丽丝"
"01a_02000.bin.json:162","弓道部を選んだ理由と同じ。けれど、","弓道部を選んだ理由と同じ。けれど、","02000:162","False","","",""
"01a_02000.bin.json:164","『……[#]この部室の中で二人きりにはさせられない』","『……[#]この部室の中で二人きりにはさせられない』","02000:164","False","","","爱丽丝"
"01a_02000.bin.json:166","それだけははっきりとＮＯだ。","それだけははっきりとＮＯだ。","02000:166","False","","",""
"01a_02000.bin.json:167","だからこそ、決心固く入部したのだ。","だからこそ、決心固く入部したのだ。","02000:167","False","","",""
"01a_02000.bin.json:168","アリスが作るタルト・タタンは絶品ですよね！","アリスが作るタルト・タタンは絶品ですよね！","02000:168","False","","","小明"
"01a_02000.bin.json:171","ええ。あまり洋菓子は食べ慣れないけれど、神田さんが作ってくれた物はとても美味しい。","ええ。あまり洋菓子は食べ慣れないけれど、神田さんが作ってくれた物はとても美味しい。","02000:171","False","","","宝珠"
"01a_02000.bin.json:173","淡い笑みを作り褒めてくれる佐和良義先輩へ、ありがとうございますと言う。","淡い笑みを作り褒めてくれる佐和良義先輩へ、ありがとうございますと言う。","02000:173","False","","",""
"01a_02000.bin.json:174","褒められて面映ゆくはあるけれど、","褒められて面映ゆくはあるけれど、","02000:174","False","","",""
"01a_02000.bin.json:176","……[#]複雑な気分。","……[#]複雑な気分。","02000:176","False","","","爱丽丝"
"01a_02000.bin.json:179","それで、先輩はどのポジションなんですか？　指揮者とか似合いますよね！","それで、先輩はどのポジションなんですか？　指揮者とか似合いますよね！","02000:179","False","","","小明"
"01a_02000.bin.json:182","人懐こい子犬のように訊ねるメイへ、ああ、とようやく思い立ったように膝を叩いた。","人懐こい子犬のように訊ねるメイへ、ああ、とようやく思い立ったように膝を叩いた。","02000:182","False","","",""
"01a_02000.bin.json:184","合唱祭。そういえばクラスでそんな話をしていましたね。","合唱祭。そういえばクラスでそんな話をしていましたね。","02000:184","False","","","宝珠"
"01a_02000.bin.json:187","クールな発言も恰好いいです！","クールな発言も恰好いいです！","02000:187","False","","","小明"
"01a_02000.bin.json:190","今朝方、友だちと合唱祭の話をしていたんです。それで佐和良義先輩のクラスは何を唄うのかなって。","今朝方、友だちと合唱祭の話をしていたんです。それで佐和良義先輩のクラスは何を唄うのかなって。","02000:190","False","","","爱丽丝"
"01a_02000.bin.json:193","確か、私のクラスは大地讃頌ね。あと勿論、指揮者も伴奏もしません。","確か、私のクラスは{大地讃頌/だいちさんしょう}ね。あと勿論、指揮者も伴奏もしません。","02000:193","False","","","宝珠"
"01a_02000.bin.json:195","どちらもやったら恰好いいのにとメイが追従する。確かに想像するだに嵌まりそうだ。","どちらもやったら恰好いいのにとメイが追従する。確かに想像するだに嵌まりそうだ。","02000:195","False","","",""
"01a_02000.bin.json:197","『指揮するのも、伴奏でピアノを弾くのも似合いそうだし』","『指揮するのも、伴奏でピアノを弾くのも似合いそうだし』","02000:197","False","","","爱丽丝"
"01a_02000.bin.json:199","ただ何となく歌唱するイメージがないだけ。","ただ何となく歌唱するイメージがないだけ。","02000:199","False","","",""
"01a_02000.bin.json:200","大きなお口を開けるっていうのがイメージが湧かないのかな？","大きなお口を開けるっていうのがイメージが湧かないのかな？","02000:200","False","","","爱丽丝"
"01a_02000.bin.json:202","お口？","お口？","02000:202","False","","","宝珠"
"01a_02000.bin.json:205","え、あ……。あんまり佐和良義先輩が唄を歌うイメージが湧かないなぁって。","え、あ……。あんまり佐和良義先輩が唄を歌うイメージが湧かないなぁって。","02000:205","False","","","爱丽丝"
"01a_02000.bin.json:207","そうなの？","そうなの？","02000:207","False","","","宝珠"
"01a_02000.bin.json:209","小首を傾げサラサラと黒髪を揺らす彼女へ、大口問題を上品に伝えた。","小首を傾げサラサラと黒髪を揺らす彼女へ、大口問題を上品に伝えた。","02000:209","False","","",""
"01a_02000.bin.json:211","ああ、確かにそう言われると想像つかないかも。","ああ、確かにそう言われると想像つかないかも。","02000:211","False","","","小明"
"01a_02000.bin.json:213","ふふ、音楽の授業があるのだし私だって歌いますよ。","ふふ、音楽の授業があるのだし私だって歌いますよ。","02000:213","False","","","宝珠"
"01a_02000.bin.json:215","口元に手を当て笑う佐和良義先輩へ、そうですよねと言うも、品格ある仕草に想像するのは難しい。","口元に手を当て笑う佐和良義先輩へ、そうですよねと言うも、品格ある仕草に想像するのは難しい。","02000:215","False","","",""
"01a_02000.bin.json:217","佐和良義先輩もだけど、アリスはいいよね歌が上手で。あたしはあんまり得意じゃないからなぁ。","佐和良義先輩もだけど、アリスはいいよね歌が上手で。あたしはあんまり得意じゃないからなぁ。","02000:217","False","","","小明"
"01a_02000.bin.json:222","声だけは大きいって褒められますけどそれだけですね。アリスは合唱部を兼部してたんで上手なんです。カラオケとか行っても凄いですし！","声だけは大きいって褒められますけどそれだけですね。アリスは合唱部を兼部してたんで上手なんです。カラオケとか行っても凄いですし！","02000:222","False","","","小明"
"01a_02000.bin.json:224","カラオケ！　と声を上げる佐和良義先輩。声に愉しげな色が含まれていたようだけど――","カラオケ！　と声を上げる佐和良義先輩。声に愉しげな色が含まれていたようだけど――","02000:224","False","","",""
"01a_02000.bin.json:225","カラオケに誘ってみようかな","カラオケに誘ってみようかな","02000:225","False","","",""
"01a_02000.bin.json:227","もしかしてカラオケを知らないのかも","もしかしてカラオケを知らないのかも","02000:227","False","","",""
"01a_02000.bin.json:229","声だけでなく美しい瞳も好奇心に充ちているようで――つい気易く、","声だけでなく美しい瞳も好奇心に{充/み}ちているようで――つい気易く、","02000:229","False","","",""
"01a_02000.bin.json:231","佐和良義先輩も今度、ご一緒にどうですか？","佐和良義先輩も今度、ご一緒にどうですか？","02000:231","False","","","爱丽丝"
"01a_02000.bin.json:233","と、誘ってしまった。","と、誘ってしまった。","02000:233","False","","",""
"01a_02000.bin.json:237","ちょ、アリス！　何言ってるんだよ。先輩がカラオケなんて行くわけ――。","ちょ、アリス！　何言ってるんだよ。先輩がカラオケなんて行くわけ――。","02000:237","False","","","小明"
"01a_02000.bin.json:240","誘ってくださるの？","誘ってくださるの？","02000:240","False","","","宝珠"
"01a_02000.bin.json:243","聞き間違いじゃない。","聞き間違いじゃない。","02000:243","False","","",""
"01a_02000.bin.json:245","おずおずとしながらも声に期待する気持ちが含まれているのが分かる。わたしは、もし良ければと言った。","おずおずとしながらも声に期待する気持ちが含まれているのが分かる。わたしは、もし良ければと言った。","02000:245","False","","",""
"01a_02000.bin.json:247","本当に？　一度行ってみたいと思っていたんです。","本当に？　一度行ってみたいと思っていたんです。","02000:247","False","","","宝珠"
"01a_02000.bin.json:250","それじゃ是非に！","それじゃ是非に！","02000:250","False","","","爱丽丝"
"01a_02000.bin.json:253","ふふっ大きな声を出したら気持ちよさそう。","ふふっ大きな声を出したら気持ちよさそう。","02000:253","False","","","宝珠"
"01a_02000.bin.json:255","口元に手をやり上品に笑う彼女へ、あたしも！　と手を挙げるメイ。嫉妬よりも勢いに釣られて笑顔になる。","口元に手をやり上品に笑う彼女へ、あたしも！　と手を挙げるメイ。嫉妬よりも勢いに釣られて笑顔になる。","02000:255","False","","",""
"01a_02000.bin.json:256","それじゃ三人で行きましょう！","それじゃ三人で行きましょう！","02000:256","False","","","爱丽丝"
"01a_02000.bin.json:259","瞳には戸惑いの感情が声に入っているようで、","瞳には戸惑いの感情が声に入っているようで、","02000:259","False","","",""
"01a_02000.bin.json:260","もしかして佐和良義先輩、カラオケって知らないんですか？","もしかして佐和良義先輩、カラオケって知らないんですか？","02000:260","False","","","爱丽丝"
