"location","source","target","id","fuzzy","context","translator_comments","developer_comments"
"01a_01300.bin.json:213","顧問の先生は玄関の靴箱の上にあったと言いながらもまだ視線は外せていない。","顧問の先生は玄関の靴箱の上にあったと言いながらもまだ視線は外せていない。","01300:213","False","","",""
"01a_01300.bin.json:216","封を破り手紙を取り出した宮原部長は――奇妙に顔を顰めた。","封を破り手紙を取り出した宮原部長は――奇妙に顔を顰めた。","01300:216","False","","",""
"01a_01300.bin.json:217","どうされたのですか。","どうされたのですか。","01300:217","False","","","宝珠"
"01a_01300.bin.json:219","これは……いえ、部内での話ですから……。","これは……いえ、部内での話ですから……。","01300:219","False","","","宫原"
"01a_01300.bin.json:222","弱々しく答える宮原部長へ、佐和良義先輩は彼女の顔を視、次いで手紙を視た。","弱々しく答える宮原部長へ、佐和良義先輩は彼女の顔を視、次いで手紙を視た。","01300:222","False","","",""
"01a_01300.bin.json:223","おやおやと底意地の悪い猫のように歪められた目に、わたしも興味がそそられ手にした手紙をそっと覗いた。其処には――……","おやおやと底意地の悪い猫のように歪められた目に、わたしも興味がそそられ手にした手紙をそっと覗いた。其処には――……","01300:223","False","","",""
"01a_01300.bin.json:226","[b]“優勝カップを壊したのは穂高明ではない”[k]","[b]“優勝カップを壊したのは穂高明ではない”[k]","01300:226","False","","",""
"01a_01300.bin.json:227","そう、手紙の真ん中に一文だけ書かれていた……。","そう、手紙の真ん中に一文だけ書かれていた……。","01300:227","False","","",""
