"location","source","target","id","fuzzy","context","translator_comments","developer_comments"
"01a_02600.bin.json:134","講堂にある大きな姿見を見遣る。確かに何度も手鏡で確認していたと聞いている。本当に……？","看望礼堂里的大姿。听说确实用手镜确认了好几次。真的……？","02600:134","False","","","

看望礼堂里的大姿。听说确实用手镜确认了好几次。真的……？

我望着礼堂里的大穿衣镜。听说确实用小镜子确认过好几次。真的……？"
"01a_02600.bin.json:135","ち、違います。そんな……。","不、不对。怎么会……","02600:135","False","","","木野

不、不对。怎么会……

不是的。那样……"
"01a_02600.bin.json:137","……[#]そう。病院には罹っていないのかしら。でも貴女には自覚があった。そうでしょう。","……[#]对。没有去医院吗？但是你有自己的觉悟。是吧。","02600:137","False","","","宝珠

……[#]对。没有去医院吗？但是你有自己的觉悟。是吧。

……[#]是的。没有感染医院吗？但是你有自觉。是吧。"
"01a_02600.bin.json:139","朱の眼に見詰められ、額に汗を滲ませながらも……肯いた。佐和良義先輩は視線をそのままに、","被朱眼盯着，额头上渗出汗……我同意了。佐和良义前辈保持视线，","02600:139","False","","","

被朱眼盯着，额头上渗出汗……我同意了。佐和良义前辈保持视线，

虽然被朱红的眼睛盯着，额头上渗出了汗水……点点头。佐和良义前辈保持视线。"
"01a_02600.bin.json:140","登校できなくなった理由は――ピアノ奏者を続けることが出来なくなったからなのね。","不能上学的理由是——因为不能继续钢琴演奏者了。","02600:140","False","","","宝珠

不能上学的理由是——因为不能继续钢琴演奏者了。

不能上学的理由是——不能继续当钢琴演奏者了。"
"01a_02600.bin.json:142","え……？　それは……どういうことですか？","诶……？那是……什么意思？","02600:142","False","","","爱丽丝

诶……？那是……什么意思？

呃……？那是因为……这是怎么回事？"
"01a_02600.bin.json:145","それは……彼女が罹っている“醜形恐怖症”が関係している。木野ゆり香は、","那是……这与她罹患的“丑形恐惧症”有关。木野友理香说，","02600:145","False","","","宝珠

那是……这与她罹患的“丑形恐惧症”有关。木野友理香说，

那是因为……这与她罹患的“丑形恐惧症”有关。木野友理香说："
"01a_02600.bin.json:147","そこでようやく視線を外し、講堂の――大きな姿見を横目にした。","于是，她终于移开视线，侧目了礼堂的——巨大的姿态。","02600:147","False","","","

于是，她终于移开视线，侧目了礼堂的——巨大的姿态。

这时，她终于移开视线，斜眼望向礼堂的那面巨大的穿衣镜。"
"01a_02600.bin.json:148","彼女は、姿見で自分の姿を視てしまうことが我慢ならなかった。","她无法忍受在镜子里看到自己的样子。","02600:148","False","","","宝珠

她无法忍受在镜子里看到自己的样子。

她忍不住用姿态看自己的样子。"
"01a_02600.bin.json:150","目にしたくなくともピアノを演奏する以上、どうしても姿見に演奏する自分が目に入ってしまう。それが苦痛で仕方なかった。","即使不想看到，既然演奏钢琴，无论如何都会看到演奏姿态的自己。那是痛苦得不得了。","02600:150","False","","","宝珠

即使不想看到，既然演奏钢琴，无论如何都会看到演奏姿态的自己。那是痛苦得不得了。

虽然不想看到，但既然演奏钢琴，就难免会看到镜子里演奏的自己。这让我痛苦不已。"
"01a_02600.bin.json:152","…………[#]ッ。","…………[#]嗯。","02600:152","False","","","木野

…………[#]嗯。

…………[#]月色。"
"01a_02600.bin.json:154","痛みを堪えるかのように俯き、己が腕を掴む。","像是忍受着痛苦一样低头，自己抓住手臂。","02600:154","False","","","

像是忍受着痛苦一样低头，自己抓住手臂。

她像是在忍受疼痛似的低着头，抓住自己的手臂。"
"01a_02600.bin.json:155","木野さんの態度を見ると……事実のようだけれど、わたしは合点がいかなかった。","看了木野同学的态度……虽然好像是事实，但我没有理解。","02600:155","False","","","

看了木野同学的态度……虽然好像是事实，但我没有理解。

看木野同学的态度……这似乎是事实，但我无法理解。"
"01a_02600.bin.json:156","で、でも佐和良義先輩のお話ですと、“醜形恐怖症”は鏡で自分の姿を何度も確認する、と言っていましたよね。","但是，佐和良义前辈说过，“丑形恐惧症”是指反复对着镜子确认自己的样子。","02600:156","False","","","爱丽丝

但是，佐和良义前辈说过，“丑形恐惧症”是指反复对着镜子确认自己的样子。

但是，根据佐和良义前辈的话，“丑形恐惧症”会用镜子多次确认自己的样子。"
"01a_02600.bin.json:159","なら、そうしてしまう症状なら、なぜ木野さんは鏡を見ることがそんなにもイヤだったのですか？","那么，如果是这样的症状的话，为什么木野同学那么讨厌看镜子呢？","02600:159","False","","","爱丽丝

那么，如果是这样的症状的话，为什么木野同学那么讨厌看镜子呢？

既然是这样的症状，为什么木野同学那么讨厌照镜子呢？"
"01a_02600.bin.json:164","黙り込む木野さんを一瞥し、","瞥了一眼沉默的木野同学，","02600:164","False","","","

瞥了一眼沉默的木野同学，

瞥了一眼沉默不语的木野同学。"
"01a_02600.bin.json:166","……[#]彼女は視たくても視られなかった。","……[#]她想看也看不见。","02600:166","False","","","宝珠

……[#]她想看也看不见。

……[#]她想看也看不见。"
"01a_02600.bin.json:168","とても痛ましい顔つきをした佐和良義先輩はそう呟いた。","表情非常可怜的佐和良义前辈这样嘟囔着。","02600:168","False","","","

表情非常可怜的佐和良义前辈这样嘟囔着。

一脸沉痛的佐和良义前辈喃喃道。"
"01a_02600.bin.json:169","戸惑うわたしへ、木野ゆり香が抱える問題を解決するためのふたつ目の問題、それは神田さんへ向けた怒りの理由、なのだと佐和良義先輩は告げた。","佐和良义前辈告诉了困惑的我，解决木野友理香所面临的问题的第二个问题，那是对神田同学愤怒的理由。","02600:169","False","","","

佐和良义前辈告诉了困惑的我，解决木野友理香所面临的问题的第二个问题，那是对神田同学愤怒的理由。

面对困惑的我，佐和良义前辈告诉我，解决木野友理香问题的第二个问题，就是向神田同学发怒的理由。"
"01a_02600.bin.json:170","そう、神田さんへ向けた怒り――それは“家族写真”が関係している。","没错，对神田同学的愤怒——这和“全家福”有关。","02600:170","False","","","宝珠

没错，对神田同学的愤怒——这和“全家福”有关。

是的，对神田同学的愤怒——这和“全家福”有关系。"
"01a_02600.bin.json:173","家族写真……！","全家福……！","02600:173","False","","","爱丽丝

全家福……！

全家福……！"
"01a_02600.bin.json:175","それは自分も理由のひとつだと思っていたことだ。勝手に写真を見てしまったこと。そして誰それに似ていると批評じみた話をしてしまったこと。","自己也认为这是理由之一。擅自看了照片。然后说了些批评的话，说谁长得像那个。","02600:175","False","","","

自己也认为这是理由之一。擅自看了照片。然后说了些批评的话，说谁长得像那个。

我也认为那是理由之一。擅自看了照片。然后，谁评论说和那个相似。"
"01a_02600.bin.json:176","……[#]確かに怒りは感じています。","……[#]我确实感到愤怒。","02600:176","False","","","木野

……[#]我确实感到愤怒。

……[#]确实感到愤怒。"
"01a_02600.bin.json:178","木野さん……。","木野同学……","02600:178","False","","","爱丽丝

木野同学……

木野さん……"
"01a_02600.bin.json:180","でも、初めは怒りでなく戸惑いだった。貴女は何故――。","但是，一开始不是愤怒而是困惑。你为什么——","02600:180","False","","","木野

但是，一开始不是愤怒而是困惑。你为什么——

但是，一开始不是愤怒，而是困惑。你为什么……"
"01a_02600.bin.json:182","黒い炎が灯った目でわたしを睨む。思わずたじろぐわたしの背を、佐和良義先輩は支えた。それを目にし、更に黒い感情に炎がくべられる。","用黑色的火焰亮着的眼睛盯着我。佐和良义前辈支持着我不由得畏缩不前的背影。看到这一幕，更黑的感情让火焰燃烧。","02600:182","False","","","

用黑色的火焰亮着的眼睛盯着我。佐和良义前辈支持着我不由得畏缩不前的背影。看到这一幕，更黑的感情让火焰燃烧。

用闪着黑色火焰的眼睛瞪着我。我不由得后退了几步，佐和良义前辈扶住了我的背。看到这一幕，更燃起了黑色的感情火焰。"
"01a_02600.bin.json:184","何故、母でなく父に似てるなんて言ったの……！　今までは誰も、誰一人、父に似ているなんて言わなかったのに！","为什么说不是母亲而是像父亲呢……！到现在为止，没有一个人说过，说我长得像父亲！","02600:184","False","","","木野

为什么说不是母亲而是像父亲呢……！到现在为止谁都没有说，谁都像父亲！

为什么说不像妈妈，而像爸爸呢……！到现在为止，没有一个人，没有一个人说过像父亲！"
"01a_02600.bin.json:186","母さんを裏切り私たちを捨てて勝手に死んだ父に似ているなんて……！","背叛母亲，像抛弃我们擅自死去的父亲……！","02600:186","False","","","木野

背叛母亲，像抛弃我们擅自死去的父亲……！

竟然像背叛老妈抛弃我们擅自死去的父亲……！"
"01a_02600.bin.json:188","静かに激高する彼女に戸惑う。怒りに圧されながらも、“誰一人”と言った彼女の言葉に引っかかりを覚えたのだ。","对安静激昂的她感到困惑。虽然被愤怒压住了，但还是被她说“一个人”的话所吸引。","02600:188","False","","","

对安静激昂的她感到困惑。虽然被愤怒压住了，但还是被她说“一个人”的话所吸引。

她平静而激动，让我感到困惑。虽然被愤怒所压倒，但她说的“每个人”这句话还是让我觉得很奇怪。"
"01a_02600.bin.json:190","で、でも、口元があんなに似ていたら――。","但是，但是，如果嘴角那么像的话——","02600:190","False","","","爱丽丝

但是，但是，如果嘴角那么像的话——

但是，如果嘴角那么相似的话——"
"01a_02600.bin.json:192","貴女の言葉の所為で私は……ッ！","因为你的话，我……！","02600:192","False","","","木野

因为你的话，我……！

为了你的话我……哇！"
"01a_02600.bin.json:194","……[#]……っ。","……[#]……","02600:194","False","","","爱丽丝

……[#]……嗯。

……[#]……买。"
"01a_02600.bin.json:196","感情を叩きつけられ怯み、言葉を紡ごうとしても口を塞がれたように何も言えなかった。","被灌输感情的胆怯，即使想编织语言也像堵住了嘴一样什么也说不出来。","02600:196","False","","","

被灌输感情的胆怯，即使想编织语言也像堵住了嘴一样什么也说不出来。

她害怕感情被打击，想要编织语言却像被堵住了嘴一样什么也说不出来。"
"01a_02600.bin.json:197","――神田アリスは、貴女に呪いをかけようとしていたのではない。","——神田爱丽丝并不是想诅咒你。","02600:197","False","","","宝珠

——神田爱丽丝并不是想诅咒你。

——神田爱丽丝并不是想要诅咒你。"
"01a_02600.bin.json:199","だとしても、奇をてらって言ったことだとしても――。","即使，即使是为了出奇说的——","02600:199","False","","","木野

即使，即使是为了出奇说的——

即使是这样，即使是说了奇怪的话——"
"01a_02600.bin.json:201","そうじゃない。此はただの視点の違い。","不是那样的。这只是视点的不同。","02600:201","False","","","宝珠

不是那样的。这只是视点的不同。

不是这样的。这只是视角的不同。"
"01a_02600.bin.json:203","佐和良義先輩は言う。","佐和良义前辈说。","02600:203","False","","","

佐和良义前辈说。

佐和良义前辈说。"
"01a_02600.bin.json:204","あの日、東屋で話していたように、日本と欧米での観察する箇所の違いを。","就像那天在亭子里说的那样，日本和欧美观察的地方的不同。","02600:204","False","","","

就像那天在亭子里说的那样，日本和欧美观察的地方的不同。

那天，正如东屋所说的那样，在日本和欧美观察的地方有什么不同。"
"01a_02600.bin.json:205","日本では目を見て感情を推し量るため、サングラスを付けている人を見ると警戒し、欧米人は口元で表情を読み取るためマスクを異物と感じる、と。そう告げ――……","在日本，为了通过眼睛来推测感情，看到戴着墨镜的人会警惕，欧美人为了用嘴读取表情，会觉得口罩是异物。这样告诉我——……","02600:205","False","","","

在日本，为了通过眼睛来推测感情，看到戴着墨镜的人会警惕，欧美人为了用嘴读取表情，会觉得口罩是异物。这样告诉我——……

在日本，人们通过看眼睛来推测感情，所以看到戴墨镜的人就会提高警惕，而欧美人则通过嘴角来判断表情，所以会觉得口罩是异物。这样告诉你——……"
"01a_02600.bin.json:206","神田さんは元々、英国で幼少期を過ごしていたので人を視、その人となりを判断するのに“口元”を観察する。だから、家族写真に写る父親を目にしたときにまず口元に視線がいった。","神田同学原本就在英国度过了童年时期，所以为了观察别人，判断其为人，观察“嘴角”。所以，看到拍在全家福上的父亲的时候，首先视线投向了嘴角。","02600:206","False","","","宝珠

神田同学原本就在英国度过了童年时期，所以为了观察别人，判断其为人，观察“嘴角”。所以，看到拍在全家福上的父亲的时候，首先视线投向了嘴角。

神田同学原本是在英国度过幼年时期的，所以她看人，判断一个人的为人时会观察“嘴角”。所以，当她看到全家福上的父亲时，目光首先落在了她的嘴边。"
"01a_02600.bin.json:208","そうだったのかと合点がいった。誰も指摘してなかったのは皆はまず目元を見て、母親似だと判断しそこで話が終わっていたから。","原来是这样啊，我恍然大悟。谁也没有指出，因为大家都是先看眼睛，判断像母亲就结束了。","02600:208","False","","","

原来是这样啊，我恍然大悟。谁也没有指出，因为大家都是先看眼睛，判断像母亲就结束了。

我明白是不是那样。谁都没有指出是因为大家首先看了眼睛，判断出长得像母亲，于是就结束了谈话。"
"01a_02600.bin.json:209","だから父親似だと指摘したのはわたしだけだった……。","所以指出和父亲相似的只有我……","02600:209","False","","","

所以指出和父亲相似的只有我……

所以只有我指出她长得像父亲……"
"01a_02600.bin.json:210","……[#]理由は分かりました。けれど、その言葉の所為で――初めて告げられた指摘の所為で、貴女の言葉が呪いになってしまった。","……[#]我明白了理由。但是，因为那句话——因为第一次被告知的指摘，你的话变成了诅咒。","02600:210","False","","","木野

……[#]我明白了理由。但是，因为那句话——因为第一次被告知的指摘，你的话变成了诅咒。

……[#]我知道了理由。但是，因为那句话——因为第一次被告知的指责，你的话变成了诅咒。"
"01a_02600.bin.json:212","呪い……？　それはどういう――。","诅咒……？那是什么样的——","02600:212","False","","","爱丽丝

诅咒……？那是什么样的——

诅咒……？那是怎么回事——"
"01a_02600.bin.json:214","事かと問おうとするわたしへ、暗示じみた呪いよ、と佐和良義先輩が告げた。彼女は朱の眼で木野さんを見遣りながら、","佐和良义前辈告诉了要问是不是事情的我，这是暗示般的诅咒。她用朱眼看着木野同学，","02600:214","False","","","

佐和良义前辈告诉了要问是不是事情的我，这是暗示般的诅咒。她用朱眼看着木野同学，

我正想问，佐和良义前辈告诉我，这是暗示性的诅咒。她用红色的眼睛看着木野。"
"01a_02600.bin.json:216","神田さんに指摘されてから、醜形恐怖症のため何度も鏡を視るたびに――初めは口元だけが、そしてじょじょに鏡に映る姿が、厭うている父親に観えるようになった。そうですね。","自从神田同学指出后，因为丑形恐惧症，每次看镜子好几次——一开始只有嘴角，然后渐渐地照在镜子里的样子，让讨厌的父亲看到了。是啊。","02600:216","False","","","宝珠

自从神田同学指出后，因为丑形恐惧症，每次看镜子好几次——一开始只有嘴角，然后渐渐地照在镜子里的样子，让讨厌的父亲看到了。是啊。

自从被神田同学指出这一点后，因为丑态恐惧症，我每次照镜子——一开始只是嘴角，然后慢慢地，镜子里的样子，就变成了讨厌的父亲。是啊。"
"01a_02600.bin.json:219","……[#]はい。初めは気にしすぎてしまったから父の影を観てしまうのだと思ってました。でも、ずっと……！　鏡に映る像は、はっきりと亡くなった父を映して……！","……[#]是的。一开始我觉得是因为太在意了所以看了父亲的影子。但是，一直……！镜子里的像，映照着清晰死去的父亲……！","02600:219","False","","","木野

……[#]是的。一开始我觉得是因为太在意了所以看了父亲的影子。但是，一直……！镜子里的像，映照着清晰死去的父亲……！

……[#]是一开始我以为是因为太在意了，才看到了父亲的影子。但是，一直……！镜子里映出的影像，清楚地映出了死去的父亲……！"
"01a_02600.bin.json:221","嫌悪を抱いている父親の顔を視たくないために、手鏡を捨てた。","为了不想看到厌恶的父亲的脸，她扔掉了小镜子。","02600:221","False","","","宝珠

为了不想看到厌恶的父亲的脸，她扔掉了小镜子。

为了不想看到父亲厌恶的脸，她把手镜扔掉了。"
"01a_02600.bin.json:223","頷き、肯定する。","点头，肯定。","02600:223","False","","","

点头，肯定。

她点点头，表示肯定。"
"01a_02600.bin.json:224","わたしへ向けていた怒りの理由。","对我愤怒的理由。","02600:224","False","","","

对我愤怒的理由。

对我愤怒的理由。"
"01a_02600.bin.json:225","『わたしは……なんてことを……』","“我……怎么回事……”","02600:225","False","","","爱丽丝

“我……怎么回事……”

“我……怎么回事……”"
"01a_02600.bin.json:227","何げなく告げた言葉がそれほどまでに苦しめるなんて……。","不知怎么说的话竟然那么痛苦……","02600:227","False","","","

不知怎么说的话竟然那么痛苦……

若无其事地说了几句话，竟然让人如此痛苦……"
"01a_02600.bin.json:228","木野さんが言うようにそれは呪いだ。","正如木野同学所说，那是诅咒。","02600:228","False","","","

正如木野同学所说，那是诅咒。

正如木野所说，那是诅咒。"
"01a_02600.bin.json:229","本来視たくてたまらない手鏡も捨て、自宅でも鏡を目にしないように工夫した。","扔掉了本来就很想看的小镜子，在家里也努力不去看镜子。","02600:229","False","","","宝珠

扔掉了本来就很想看的小镜子，在家里也努力不去看镜子。

把本来就想看的手镜也扔掉，在家也不看镜子。"
"01a_02600.bin.json:231","学校でも注意すれば目に映さないようにするのは容易だった。でも、ひとつだけどうしようもない事がある。","在学校里，只要多加注意，不让人看到是很容易的。但是，有一件事是无法解决的。","02600:231","False","","","宝珠

在学校里，只要多加注意，不让人看到是很容易的。但是，有一件事是无法解决的。

学校也很容易注意到不让眼睛看到。但是，有一件事是没办法的。"
"01a_02600.bin.json:233","つっと朱の眼を講堂の壇上へ、","突然把朱的眼睛放在讲堂的台上，","02600:233","False","","","

突然把朱的眼睛放在讲堂的台上，

她把那双泛红的眼睛转向讲台。"
"01a_02600.bin.json:234","否、","不，","02600:234","False","","","

不，

与否，"
"01a_02600.bin.json:235","ピアノの後ろへと鎮座する大きな姿見へと送った。","送去了坐在钢琴后面的大姿态。","02600:235","False","","","

送去了坐在钢琴后面的大姿态。

送到钢琴后面的大穿衣镜上。"
"01a_02600.bin.json:236","ああ、そうだ。","啊，对了。","02600:236","False","","","

啊，对了。

啊，对了。"
"01a_02600.bin.json:237","だから、あのとき、","所以，那个时候，","02600:237","False","","","

所以，那个时候，

所以，那个时候，"
"01a_02600.bin.json:238","木野ゆり香は、","木野友理香说，","02600:238","False","","","

木野友理香说，

木野友理香说："
"01a_02600.bin.json:239","――彼女が不登校になったのは、ピアノの伴奏ができなく為ったから。何故なら、鍵盤を叩く横で、“父親が鏡の中から凝っと見詰めている”のだから。","——她不去上学是因为不能弹钢琴伴奏。因为，在敲击琴键的旁边，“父亲正从镜子里凝神注视着”。","02600:239","False","","","宝珠

——她不去上学是因为不能弹钢琴伴奏。因为，在敲击琴键的旁边，“父亲正从镜子里凝神注视着”。

——她之所以不上学，是因为她不能伴奏钢琴。因为，在敲键盘的旁边，“父亲从镜子里凝视着”。"
"01a_02600.bin.json:241","……[#]ひっ！","……[#]啊！","02600:241","False","","","木野

……[#]啊！

……[#]哈！"
"01a_02600.bin.json:243","佐和良義宝珠の向けた視線へ、誘蛾灯に惹かれる蛾のように誘われた目線は――","佐和良义宝珠的视线，像被诱蛾灯吸引的飞蛾一样被邀请的视线是——","02600:243","False","","","

佐和良义宝珠的视线，像被诱蛾灯吸引的飞蛾一样被邀请的视线是——

佐和良义宝珠投来的视线，像被诱蛾灯吸引的蛾子般吸引——"
"01a_02600.bin.json:244","嗤う父の姿を見付けてしまったのだろう。青ざめ、悲鳴をあげて顔を背けた。","大概是发现了嘲笑父亲的样子吧。脸色苍白，发出悲鸣，脸都背了过去。","02600:244","False","","","

大概是发现了嘲笑父亲的样子吧。脸色苍白，发出悲鸣，脸都背了过去。

大概是看到了父亲的嘲笑吧。脸色铁青，惨叫着转过脸去。"
"01a_02600.bin.json:245","身を丸め、震える彼女の背に、わたしは何と声を掛けたらいいか……躊躇していた。原因を作ったわたしが何と声を掛ければいいのかと。","我不知道该对弓着身子颤抖的她的背说什么才好……踌躇了。制造原因的我该说什么才好呢？","02600:245","False","","","

我不知道该对弓着身子颤抖的她的背说什么才好……踌躇了。制造原因的我该说什么才好呢？

我该怎么跟她蜷缩着身子颤抖的背上打招呼呢……犹豫了。我想，造成原因的我该怎么打招呼呢？"
"01a_02600.bin.json:246","……[#]神田さんはいいわよね。","……[#]神田同学真好啊。","02600:246","False","","","木野

……[#]神田同学真好啊。

……[#]神田同学真好啊。"
