"location","source","target","id","fuzzy","context","translator_comments","developer_comments"
"01a_01700.bin.json:145","何故だか戸惑っている佐和良義先輩を見、わたしも内心首を傾げてしまう。林檎が好きじゃないとか？","不知为何看到不知所措的佐和良义前辈，我也内心歪着头。你不喜欢苹果吗？","01700:145","False","","","

不知为何看到不知所措的佐和良义前辈，我也内心歪着头。你不喜欢苹果吗？

看着不知为何不知所措的佐和良义前辈，我也在心里歪着头。不喜欢苹果吗？"
"01a_01700.bin.json:147","へぇ、お茶請けって何でもいいんですね！","啊，茶点什么都可以呢！","01700:147","False","","","小明

啊，茶点什么都可以呢！

哦，茶点什么都可以啊！"
"01a_01700.bin.json:149","え？","诶？","01700:149","False","","","爱丽丝

诶？

呃？"
"01a_01700.bin.json:152","だって茶道って和だし、お茶請けも和菓子しかダメなのかと思ってた。","因为茶道是和式的，我还以为茶点也只能是和式点心呢。","01700:152","False","","","小明

因为茶道是和式的，我还以为茶点也只能是和式点心呢。

因为茶道是和式的，我觉得茶点也只有和式点心不行。"
"01a_01700.bin.json:156","ええ。本当は和菓子が良いのだけれど――。","是的。其实和式点心比较好——","01700:156","False","","","宝珠

是的。其实和式点心比较好——

嗯。其实和式点心比较好——"
"01a_01700.bin.json:159","言われ、意味を理解した途端、かっと頬が熱くなる。ありがとうの意味を込めたお菓子で礼を失してしまうなんて。","听她这么一说，我明白了她的意思，顿时脸颊发热。带着感谢之意的点心竟然会失礼。","01700:159","False","","","

被说了，一理解了意思，脸就一下子热起来。用包含了谢谢的意思的点心失去了礼。

听她这么一说，我明白了她的意思，顿时脸颊发热。带着感谢之意的点心竟然会失礼。"
"01a_01700.bin.json:161","あ、そ、それじゃ――。","啊，那，那就——","01700:161","False","","","爱丽丝

啊，那，那就——

啊，那么——"
"01a_01700.bin.json:163","でも、とても美味しそう。","但是，看起来很好吃。","01700:163","False","","","宝珠

但是，看起来很好吃。

但是，看起来很好吃。"
"01a_01700.bin.json:166","アリスの手作りお菓子は絶品ですよ！","爱丽丝亲手做的点心是绝品哦！","01700:166","False","","","小明

爱丽丝亲手做的点心是绝品哦！

爱丽丝亲手做的点心是绝品哦！"
"01a_01700.bin.json:168","勧められ、淡い笑みをみせ頷く。そしてどこか独白するかのように、","听她这么一说，前辈露出淡淡的笑容，点了点头。然后像是在自言自语似的说：","01700:168","False","","","

被劝，露出淡淡的笑容点头。然后好像在哪里独白一样，

听她这么一说，她露出淡淡的笑容，点了点头。然后像是在自言自语似的说："
"01a_01700.bin.json:169","……[#]新しい変化を受け入れなければいけない。","……[#]必须接受新的变化。","01700:169","False","","","宝珠

……[#]必须接受新的变化。

……[#]必须接受新的变化。"
"01a_01700.bin.json:171","そう呟いたのだ。","她喃喃自语道。","01700:171","False","","","

我这样嘟囔着。

她喃喃自语道。"
"01a_01700.bin.json:173","『新しい変化……』","“新的变化……”","01700:173","False","","","爱丽丝

“新的变化……”

“新的变化……”"
"01a_01700.bin.json:175","わたしとメイが弓道部を辞めたこと。それは大きなふたつの変化だ。","我和小明从弓道社退部的事。那是最大的两个变化。","01700:175","False","","","

我和小明从弓道社退部的事。那是最大的两个变化。

我和小明退部了弓道部的工作。那是两个很大的变化。"
"01a_01700.bin.json:176","３つめの変化。","第三个变化。","01700:176","False","","","

第三个变化

第三个变化。"
"01a_01700.bin.json:177","――佐和良義先輩。","——佐和良义前辈。","01700:177","False","","","爱丽丝

——佐和良义前辈。

——佐和良义前辈。"
"01a_01700.bin.json:179","わたしの声音で察したのだろう、洋菓子を切り分けようと立ち上がった佐和良義先輩は再び正座し、わたしへと向き合ってくれた。","佐和良义前辈大概是察觉到了我的声音，站起身来准备切西点的她再次端坐下来，面对着我。","01700:179","False","","","

大概是我的声音察觉到的吧，为了切开西点而站起来的佐和良义前辈再次跪坐，面对我。

佐和良义前辈大概从我的声音中察觉到了我的声音，站起身来准备切西点的她再次端坐下来，面对着我。"
"01a_01700.bin.json:181","座し、真意を聴こうとする彼女の眼差しは、あの時に視た赤い目のようだった。","她坐下来，我想要了解她真正的想法，那眼神就像当时看到的那双红眼。","01700:181","False","","","

坐着，想要倾听她的真意的眼神，就像那时看到的红色眼睛一样。

她坐下来，想要了解她真正的想法，那眼神就像当时看到的那双红眼。"
"01a_01700.bin.json:182","瞳を通して、わたしの中を照らし覗き視るような。","仿佛透过眼睛，窥视着我的内心。","01700:182","False","","","

通过眼睛，像是在照亮我的内心，窥视着一样。

仿佛透过眼睛，窥视着我的内心。"
"01a_01700.bin.json:183","……でも、その目に不快感はなかった。","……但是，她的眼睛里没有不愉快的感觉。","01700:183","False","","","

……但是，我对那眼睛没有不快。

……但是，她的眼睛里没有不愉快的感觉。"
"01a_01700.bin.json:184","まるで澄んだ水が、わたしの心の奥に隠された秘密の気持ちを浮かび上がらせるかのように。","就像清澈的水，让我内心深处隐藏的秘密浮出水面一样。","01700:184","False","","","

就像清澈的水，让我内心深处隐藏的秘密浮出水面一样。

仿佛清澈的水，仿佛让我内心深处隐藏的秘密的心情浮现出来一样。"
"01a_01700.bin.json:185","それは秋風のような澄んだ爽やかな心持ちにさせた。","那让我有一种秋风般清澈清爽的心情。","01700:185","False","","","

那让我有一种秋风般清澈清爽的心情。

那感觉就像秋风一样清爽。"
"01a_01700.bin.json:187","――佐和良義先輩。わたしを茶道部へ入部させてください。","——佐和良义前辈。请让我加入茶道部。","01700:187","False","","","爱丽丝

——佐和良义前辈。请让我加入茶道部。

——佐和良义前辈。请让我加入茶道部。"
"01a_01700.bin.json:189","震え伝えた言葉は、","我颤抖传达的话语，","01700:189","False","","","

颤抖传达的话语，

她颤抖地说。"
"01a_01700.bin.json:190","佐和良義宝珠の、","以佐和良义宝珠的，","01700:190","False","","","

佐和良义宝珠的

佐和良宝珠的，"
"01a_01700.bin.json:192","初めて目にした柔和な笑顔が答えだった。","第一次看到的柔和的笑容为答案。","01700:192","False","","","

第一次看到的柔和的笑容是答案。

第一次看到的温柔的笑容就是答案。"
