"location","source","target","id","developer_comments"
"01a_01200.bin.json:304","01200:304","红色的眼睛，浮现出有如我所说的“迷惘”的光芒。除了细微的笑容以外，第一次看到的感情，不知为何强烈撼动我的心。","01200:304","
红色的眼睛，浮现出有如我所说的“迷惘”的光芒。除了细微的笑容以外，第一次看到的感情，不知为何强烈撼动我的心。

红色的眼睛，浮现出我所说的那种让人感到“迷惑”的光。除了微笑以外，第一次看到的感情，不知为何内心被强烈地动摇了。

红色的瞳孔里，浮现出我所说的那种“迷茫”的光芒。除了微笑以外，第一次看到这种感情，不知为何内心强烈地动摇了。"
"01a_01200.bin.json:305","01200:305","让人联想到白鱼的食指，缓缓地抚过眼角——发出了不轻微的朗笑声。","01200:305","
让人联想到白鱼的食指，缓缓地抚过眼角——发出了不轻微的朗笑声。

让人联想到白鱼的食指，缓缓地抚摸着眼角——发出不微弱的朗声笑声。

让人联想到白鱼的食指，抚摸着慢慢停下来的尾巴——制造出了一种微弱的爽朗笑容。"
"01a_01200.bin.json:307","01200:307","宝珠","01200:307","
宝珠

宝珠

宝珠"
"01a_01200.bin.json:308","01200:308","我的名字是佐和良义宝珠。请多指教咯，神田爱丽丝同学。","01200:308","宝珠

我的名字是佐和良义宝珠。请多指教咯，神田爱丽丝同学。

我的名字叫佐和良义宝珠。神田爱丽丝同学，请多关照。

我的名字是佐和良义宝珠。神田爱丽丝，请多关照。"
"01a_01200.bin.json:313","01200:313","被那有如红色朦胧月亮的眼睛一问——我顿时不知所措。","01200:313","
被那有如红色朦胧月亮的眼睛一问——我顿时不知所措。

被她那红色朦胧月色般的眼眸问道——我不由得退缩了。

被红朦胧月般的眼睛问到——吓了一跳。"
"01a_01200.bin.json:314","01200:314","“我得像小明一样，说出佐和良义前辈能接受的答案。”","01200:314","爱丽丝

“我得像小明一样，说出佐和良义前辈能接受的答案。”

“像小明一样，必须说出佐和良义前辈能接受的答案。”

“必须像小明一样，说出让佐和良义前辈满意的答案。”"
"01a_01200.bin.json:316","01200:316","为了发小，我也要努力讨她欢心——","01200:316","
为了发小，我也要努力讨她欢心——……

为了发小也会喜欢——……

为了发小也会被喜欢的——……"
"01a_01200.bin.json:317","01200:317","啊……","01200:317","爱丽丝

啊……

啊……

啊……"
"01a_01200.bin.json:319","01200:319","佐和良义前辈似乎察觉到了我的犹豫，朦胧的月色在云间阴沉下来，疑心笼罩了她的双眼。","01200:319","
胧月像是看穿了我的犹豫，从云层的缝隙间露出脸来，疑心覆盖了佐和良义前辈的双眼。

朦胧月仿佛是读取了我犹豫的样子，阴沉在云间，疑心蒙住了佐和良义前辈的眼睛。

佐和良义前辈似乎察觉到了我的犹豫，朦胧的月色在云间阴沉下来，疑心笼罩了她的双眼。"
"01a_01200.bin.json:320","01200:320","我要说出的不是讨人喜欢的答案，而是我自己的心情。","01200:320","
我要说出的不是讨人喜欢的答案，而是我自己的心情。

不是为了被喜欢而回答，而是回答我自己的心情。

不是为了讨好对方而回答，而是回答我自己的心情。"
"01a_01200.bin.json:321","01200:321","她低着头，询问自己的内心。","01200:321","
她低着头，询问自己的内心。

俯首向自己的心提问。

低头扪心自问。"
"01a_01200.bin.json:322","01200:322","对我来说，那是不想被夺走的东西。虽然脑中浮现“那也是原因之一吧”的想法……","01200:322","
对我来说，那是不想被夺走的东西。虽然脑中浮现“那也是原因之一吧”的想法……

对我来说不想被夺走的东西。虽然脑海中浮现出也有这样的东西……

对我来说不想被夺走的东西。虽然脑海里浮现出应该也有那个吧……"
"01a_01200.bin.json:323","01200:323","迷惘、烦恼……","01200:323","
迷惘、烦恼……

迷茫、烦恼的话——……

迷茫、烦恼的话——……"
"01a_01200.bin.json:324","01200:324","“烦恼，迷惘……”","01200:324","爱丽丝

“烦恼，迷惘……”

“烦恼、迷茫……”

“烦恼、迷茫……”"
"01a_01200.bin.json:326","01200:326","没有坚定自我的我，总是怀抱的事物。","01200:326","爱丽丝

没有坚定自我的我，总是怀抱的事物。

没有坚定的自己的我一直抱着的东西。

这是没有坚定自我的我一直抱有的想法。"
"01a_01200.bin.json:330","01200:330","让人联想到白鱼的食指，缓缓地抚过眼角——发出了不轻微的朗笑声。","01200:330","
让人联想到白鱼的食指，缓缓地抚过眼角——发出了不轻微的朗笑声。

让人联想到白鱼的食指，缓缓地抚摸着眼角——发出不微弱的朗声笑声。

让人联想到白鱼的食指，抚摸着慢慢停下来的尾巴——制造出了一种微弱的爽朗笑容。"
"01a_01200.bin.json:331","01200:331","我的名字是佐和良义宝珠。请多指教咯，神田爱丽丝同学。","01200:331","宝珠

我的名字是佐和良义宝珠。请多指教咯，神田爱丽丝同学。

我的名字叫佐和良义宝珠。神田爱丽丝同学，请多关照。

我的名字是佐和良义宝珠。神田爱丽丝，请多关照。"
