"location","source","target","id","fuzzy","context","translator_comments","developer_comments"
"01a_01300.bin.json:146","……[#]詰問するような口調になってごめんなさい。でも、とても目を引く人だから。","……[#]很抱歉我的语气变得像在诘问。但是，因为是非常引人注目的人。","01300:146","False","","","鹤见

……[#]很抱歉我的语气变得像在诘问。但是，因为是非常引人注目的人。

……[#]对不起，我的语气像是在追问。但是，因为是非常引人注目的人。"
"01a_01300.bin.json:148","と言った。","她这么说。","01300:148","False","","","

说了。

她说。"
"01a_01300.bin.json:150","確かに衆目を惹く人だと佐和良義先輩へと目を向けた。彼女は会話を続けつつ要所をさり気なく見て取っている。と、","她把目光投向了佐和良义前辈，认为她是个引人注目的人。她一边继续对话一边若无其事地看着重点。这时，","01300:150","False","","","

确实，她把目光投向了佐和良义前辈，认为她是个吸引众人目光的人。她一边继续对话一边若无其事地看着重要的地方。单击功能区上

她把目光转向佐和良义前辈，觉得她确实是个引人注目的人。她一边继续着对话，一边若无其事地看重点。和，"
"01a_01300.bin.json:152","…………[#]ッ。","…………[#]嗯。","01300:152","False","","","鹤见

…………[#]嗯。

…………[#]月色。"
"01a_01300.bin.json:154","視線を送っていたことに気付き、佐和良義先輩と鶴見副部長の視線が交わる。","佐和良义前辈和鹤见副部长的视线交汇在一起，注意到她们的视线。","01300:154","False","","","

注意到目光投向了佐和良义前辈和鹤见副部长的视线。

佐和良义前辈和鹤见副部长的视线交汇在一起，注意到她们的视线。"
"01a_01300.bin.json:155","途端に顔を赤らめ鶴見副部長は硬直してしまった。ライトに照らされた猫が路上で硬直状態に陥ってしまうみたいに。","鹤见副部长一下子脸红了，僵直了。被灯光照射的猫好像在路上陷入了僵直状态。","01300:155","False","","","

鹤见副部长一下子脸红了，僵直了。被灯光照射的猫好像在路上陷入了僵直状态。

鹤见副部长的脸顿时红了起来，变得僵硬起来。就像被灯光照亮的猫在路上陷入僵直状态一样。"
"01a_01300.bin.json:156","わたしは何故だか交わる視線に胸がざわつき、佐和良義先輩へと軽口を叩いてしまった。","不知为何，两个人的视线交汇在一起，让我心头涌起一阵悸动，我脱口而出对佐和良义前辈的调侃。","01300:156","False","","","

不知为何，我的心被交汇的视线所打动，轻言地向佐和良义前辈。

不知为何，两个人的视线交汇在一起，让我心头涌起一阵悸动，我脱口而出对佐和良义前辈的调侃。"
"01a_01300.bin.json:157","鶴見先輩が気になるんですか","你在意鹤见前辈吗？","01300:157","False","","","

你在意鹤见前辈吗？

你在意鹤见前辈吗？"
"01a_01300.bin.json:159","随分もてますね","很受欢迎呢","01300:159","False","","","

很受欢迎呢

相当受欢迎啊"
"01a_01300.bin.json:162","……[#]鶴見先輩が気になるんですか。","……[#]你在意鹤见前辈吗？","01300:162","False","","","爱丽丝

……[#]你在意鹤见前辈吗？

……[#]你在意鹤见前辈吗？"
"01a_01300.bin.json:166","視線が物語っていると目で訴える。と、佐和良義先輩は軽く微笑み、皆目の保養になると言った。","用眼睛诉说了视线。佐和良义前辈微微一笑，说大家都很养眼。","01300:166","False","","","

用眼神诉说视线。佐和良义前辈微微一笑，说大家都很养眼。

用眼睛诉说视线在说话。佐和良义前辈轻盈地微笑着说，这是大家的保养。"
"01a_01300.bin.json:167","袴姿で凛々しい。同じ和を尊ぶ者として嬉しい。","穿着袴装凛凛。作为同样尊崇以和为贵的人，我感到高兴。","01300:167","False","","","宝珠

穿着袴装凛凛。作为同样尊重和的人我很开心。

穿着裙裤，威风凛凛。作为同样尊重和的人感到高兴。"
"01a_01300.bin.json:170","そういう意味……だったんですか。","是这个意思……原来如此。","01300:170","False","","","爱丽丝

就是这个意思……原来如此。

这个意思……是吗？"
"01a_01300.bin.json:173","特に宮原さんが一番凛々しい。彼女が射る姿も見てみたい。","特别是宫原同学最威风凛凛。我也想看看她射箭的样子。","01300:173","False","","","宝珠

特别是宫原同学最凛凛。我也想看看她射的样子。

特别是宫原老师最威风凛凛。也想看她射箭的样子。"
"01a_01300.bin.json:175","そ、そうですか……。","是、是吗……","01300:175","False","","","宫原

是、是吗……

是吗……"
"01a_01300.bin.json:177","珍しく頬を赤らめる宮原部長に、やはり面白くない顔を見せる鶴見副部長。どちらも珍しい表情に小首を傾げる。すると、","宫原部长罕见地红了脸，鹤见副部长还是露出了无趣的表情。两人都露出罕见的表情，微微歪着头。然后，","01300:177","False","","","

鹤见副部长对罕见的脸红的宫原部长露出一副没意思的样子。两个都对罕见的表情歪着头。然后

宫原部长罕见地红了脸，鹤见副部长还是露出了无趣的表情。两人都露出罕见的表情，微微歪着头。于是，"
"01a_01300.bin.json:180","佐和良義先輩は随分ともてますね。","佐和良义前辈很受欢迎呢。","01300:180","False","","","爱丽丝

佐和良义前辈很受欢迎呢。

佐和良义前辈很受欢迎呢。"
"01a_01300.bin.json:183","え、と予想外のところから殴られたように視線を外すとわたしを見遣る。黒曜石のような目がひたりとわたしを映し――顔がじょじょに赤く染まっていくのを感じた。","“啊？”她像是被人打了一拳，移开视线看着我。黑曜石般的眼睛一闪一闪地映照着我——我感到自己的脸渐渐被染红。","01300:183","False","","","

嗯，像是被预想之外的地方殴打一样，移开视线的话，我就会去看。黑曜石般的眼睛一下子映出我——感觉脸渐渐被染成红色。

“啊？”她像是被人打了一拳，移开视线看着我。黑曜石般的眼睛一闪一闪地映照着我——我感到自己的脸渐渐被染红。"
"01a_01300.bin.json:186","『ぅぅ……すごい美人……！』","“嗯……好厉害的美女……！”","01300:186","False","","","爱丽丝

“嗯……好厉害的美女……！”

“呜……好漂亮的美女……！”"
"01a_01300.bin.json:188","正面から見詰められると部長や副部長が――……","从正面看的话部长和副部长——……","01300:188","False","","","

从正面看的话部长和副部长——……

从正面看的话部长和副部长——……"
"01a_01300.bin.json:189","否、部員皆目を奪われた理由がわかる。","不，我知道大家的目光都被吸引的理由了。","01300:189","False","","","

不，我知道部员都被夺走目光的理由。

不，我知道大家都被吸引的理由了。"
"01a_01300.bin.json:190","以前映画で、同じようなシチュエーションで俳優がポケットをさぐり“目を奪われた返してくれないか”と言うシーンが頭を過り、思わず緊張から口角が上がってしまった。","以前在一部电影里有过类似的场景，演员在口袋里摸索着说：“我的眼睛被你抢走了，你能把我还给我吗？”我的脑海一闪而过，嘴角不由地因紧张而上扬。","01300:190","False","","","

以前在电影中，演员在同样的场景中抓住口袋说“被夺走了眼睛能不能还给我”的场景让我过火，不由得从紧张中嘴角上扬了。

以前在一部电影里，有过类似的场景，演员在口袋里摸索着说：“我的眼睛被你抢走了，你能把我还给我吗？”我的脑海一闪而过，嘴角不由地因紧张而上扬。"
"01a_01300.bin.json:192","ああ……！　なるほど、冗談。","啊……！原来如此，是在开玩笑。","01300:192","False","","","宝珠

啊……！原来如此，开玩笑。

啊……！原来如此，开玩笑。"
"01a_01300.bin.json:196","ふふ、もてるなんていうから。","呵呵，因为很受欢迎。","01300:196","False","","","宝珠

呵呵，因为很受欢迎。

呵呵，因为她说你受欢迎。"
"01a_01300.bin.json:198","上品に口元に手をやり告げる彼女へ、内心小首を傾げてしまう。もしかして図抜けた美人だって自覚がないのだろうか？","看着她优雅地把手放在嘴边，心心里有些疑问。难道连出类拔萃的美人都没有自觉吗？","01300:198","False","","","

看着她优雅地把手放在嘴边，心里微微歪着头。难道连出类拔萃的美人都没有自觉吗？

她优雅地把手放在嘴边，内心却歪着头。难道你没有意识到她是个出类拔萃的美女吗？"
"01a_01300.bin.json:200","それに宮原さんを前にそういう冗談を言うだなんて。彼女の方が同性にもてそうでしょう。","而且在宫原同学面前开这种玩笑。她似乎更受同性欢迎吧。","01300:200","False","","","宝珠

而且在宫原同学面前开这种玩笑。她似乎更受同性欢迎吧。

而且在宫原同学面前开了那样的玩笑。她好像更受同性欢迎吧。"
"01a_01300.bin.json:202","え？　い、いや……。","诶？不，不……","01300:202","False","","","宫原

诶？不，不……

呃？不、不……"
"01a_01300.bin.json:204","自分へ返ってくると思っていなかった部長は動揺し、頬を赤らめ顔の前で大仰に手を振った。と、鶴見副部長はやり取りを面白くなさそうな顔で凝っと見詰める。","没想到话题会回到自己身上的部长动摇了，红着脸夸张地挥着手。鹤见副部长一脸无趣地盯着她们的对话。","01300:204","False","","","

没想到会回到自己身上的部长动摇了，脸上红着脸大仰地挥手。鹤见副部长凝视着对话看起来没意思的表情。

没想到会回到自己身上的部长动摇了，在红着脸的脸前夸张地挥挥手。鹤见副部长一脸无趣地盯着她们的对话。"
"01a_01300.bin.json:205","『何だろう？』","“是什么呢？”","01300:205","False","","","爱丽丝

“是什么呢？”

“什么呢？”"
"01a_01300.bin.json:207","二人のあまり見ない表情に内心首を傾げた。すると、","看到两人难得一见的表情，我不由产生了一些疑问。然后，","01300:207","False","","","

我内心对两个人不怎么见的表情感到倾心。然后

看到两人难得一见的表情，不由得歪起了头。于是，"
"01a_01300.bin.json:209","不意にドアが開かれる音がし、顧問の先生が挨拶をし道場内へと入ってきた。そして、佐和良義先輩を見てぎょっと驚いた顔をする。","突然传来开门的声音，顾问老师打过招呼，走进道场。然后，看到佐和良义前辈，老师脸上露出吃惊的表情。","01300:209","False","","","

突然传来开门的声音，顾问老师打过招呼，走进道场。然后，看到佐和良义前辈，露出惊讶的表情。

突然听到门开的声音，顾问老师打招呼走进了道场。然后，看到佐和良义前辈，脸上露出吃惊的表情。"
"01a_01300.bin.json:210","顧問の先生へと宮原部長が見学ですと言うと、瞳を釘付けられている先生は頷き、宮原宛てだと封筒を差し出した。","宫原部长对顾问老师说要参观，老师的眼睛被深深吸引，点了点头，然后递过一个信封，说是给宫原的。","01300:210","False","","","

宫原部长对顾问老师说要参观，被钉住眼睛的老师点头，把信封交给了宫原。

宫原部长对顾问老师说要参观，老师的眼睛被深深吸引，点了点头，递过一个信封，说是给宫原的。"
"01a_01300.bin.json:211","私宛てですか？","是给我吗？","01300:211","False","","","宫原

是给我吗？

是给我的吗？"
"01a_01300.bin.json:213","顧問の先生は玄関の靴箱の上にあったと言いながらもまだ視線は外せていない。","顾问老师的视线一直在玄关的鞋柜上。","01300:213","False","","","

顾问老师的视线一直在玄关的鞋柜上。

顾问老师虽然说在玄关的鞋柜上，但视线还没有移开。"
"01a_01300.bin.json:216","封を破り手紙を取り出した宮原部長は――奇妙に顔を顰めた。","宫原部长撕开信封，取出信——奇怪地皱起了眉头。","01300:216","False","","","

撕破封取出信的宫原部长——奇怪地皱起了脸。

宫原部长撕开信封，取出信——奇怪地皱起了眉头。"
"01a_01300.bin.json:217","どうされたのですか。","怎么了？","01300:217","False","","","宝珠

你怎么了？

怎么了？"
"01a_01300.bin.json:219","これは……いえ、部内での話ですから……。","这是……不，这是部里的事……","01300:219","False","","","宫原

这是……不，这是部里的事……

这是……不，因为是部内的话……"
"01a_01300.bin.json:222","弱々しく答える宮原部長へ、佐和良義先輩は彼女の顔を視、次いで手紙を視た。","宫原部长虚弱地回答，佐和良义前辈看了看她的脸，又看了看信。","01300:222","False","","","

宫原部长虚弱地回答，佐和良义前辈看了看她的脸，又看了看信。

佐和良义前辈看到了她的脸，接着看了信，接着是给软弱回答的宫原部长。"
"01a_01300.bin.json:223","おやおやと底意地の悪い猫のように歪められた目に、わたしも興味がそそられ手にした手紙をそっと覗いた。其処には――……","我也悄悄地看到了像一只坏心眼的猫一样扭曲的眼睛，我也被引起兴趣而拿到手上的信。在那里——……","01300:223","False","","","

我也悄悄地看到了像一只坏心眼的猫一样扭曲的眼睛，我也被引起兴趣而拿到手上的信。在那里——……

“哎哟哎哟”，她那像坏猫一样扭曲的眼睛勾起了我的兴趣，我偷偷看了看手里的信。那里——……"
"01a_01300.bin.json:226","[b]“優勝カップを壊したのは穂高明ではない”[k]","[b]“打破冠军奖杯的不是穗高明”[k]","01300:226","False","","","

[b]“打破冠军杯的不是穗高明。”[k]

[b]“毁坏冠军奖杯的不是穗高明。”[k]"
"01a_01300.bin.json:227","そう、手紙の真ん中に一文だけ書かれていた……。","纸上只有这样一句话……","01300:227","False","","","

是的，信的中间只写了一句……

对，信的正中间只写了一句话……"
