"location","source","target","id","developer_comments"
"01a_01200.bin.json:2","01200:002","第一章","01200:002","
第一章

第一章

一章"
"01a_01200.bin.json:3","01200:003","——从昨天晚上开始，上学途中头脑中的雾霭一直没有散去。","01200:003","
——从昨天晚上开始，上学途中脑中的雾霭就一直没有散去。

——从昨天晚上开始，上学的时候脑子里的雾霭也没有放晴。

——从昨天晚上开始，上学途中头脑中的雾霭一直没有散去。"
"01a_01200.bin.json:8","01200:008","爱丽丝","01200:008","
爱丽丝

爱丽丝

爱丽丝"
"01a_01200.bin.json:9","01200:009","“……退部申请书的事”","01200:009","爱丽丝

“……退社申请书的事。”

“……退部申请书”

“……退部申请的事。”"
"01a_01200.bin.json:12","01200:012","昨天，社团活动结束后，我急忙去了小明的家。","01200:012","
昨天，我结束社团活动后，急忙前往小明家。

昨天，我结束社团活动，急急忙忙地往小明家赶。

昨天结束了社团活动，急忙冲向小明的家。"
"01a_01200.bin.json:13","01200:013","我的好朋友看到我时，最初只是说些俏皮话，看到我表情僵硬，才说出自己主动提出了退部申请。","01200:013","
第一次看到即使看到我也只会开玩笑的好友露出这种表情，于是主动说出退社申请书的事情。

最初是即使看到我也只会说些轻言的好朋友，但可能是看到她表情僵硬吧，自己提出了退部申请。

刚开始看到我也只会随便说说的好朋友，看到我表情僵硬，主动提出了退部申请。"
"01a_01200.bin.json:14","01200:014","明明不是小明自己做过的事情，但是部里已经决定了，然后不知什么时候开始就变成了那样，无法原谅她的气氛让人受不了。","01200:014","
小明说，明明不是自己做的，但社团里的人却已经这么决定了，而且不知不觉间，大家也都觉得既然这样，就原谅她吧。小明说她无法忍受这种气氛。

小明说，明明不是自己做的事情，但部里已经这么决定了，而且不知什么时候就变成了什么样子，想要原谅的气氛让人受不了。

小明说，虽然不是她干的，但部里已经这么规定了，而且她受不了一种不知不觉就要原谅的气氛。"
"01a_01200.bin.json:15","01200:015","“那么，就解开误会吧！”我这样宣告。她回答说“没有那种魔法般的语言”。不可能像绿野仙踪那样什么都能实现。","01200:015","
既然如此，就解开误会吧！我这么宣言，她回答“我没有那种魔法般的话语”。我可不像绿野仙踪里的魔法师，什么事都能实现哦。

那么，就解开误会吧！我这样宣言，她回答说没有那种魔法般的语言。没有像奥兹的魔法使那样什么都能实现的事。

那就消除误会吧！对这样的我，她回答说，我没有那种魔法般的语言。不可能像绿野仙踪一样什么都能实现。"
"01a_01200.bin.json:16","01200:016","我讨厌那种彻底放弃的表情。我不想看到她讨好似的接受的表情……","01200:016","
她放弃一切的表情让我很讨厌。我不想看到她露出聪明地理解一切的表情……

我讨厌放弃的表情。我不想看到她那聪明地接受的脸……

我讨厌那种彻底放弃的表情。我不想看到她聪明地接受的表情……"
"01a_01200.bin.json:18","01200:018","虽然不能使用魔法，但是如果绞尽脑汁想办法的话……","01200:018","爱丽丝

虽然我不会魔法，但只要动动脑筋，总有办法……

虽然不会使用魔法，但只要想办法……

虽然不能使用魔法，但是如果绞尽脑汁想办法的话……"
"01a_01200.bin.json:21","01200:021","春日＠？？？","01200:021","
春日＠？？？

春日＠？？？

春日＠？？？"
"01a_01200.bin.json:22","01200:022","怎么啦？","01200:022","春日

想办法？

怎么说？

什么办法？"
"01a_01200.bin.json:24","01200:024","突然，头顶传来一个声音，我瞬间抬起头。","01200:024","
突然从头上传来声音，我眨了眨眼，抬头看去。

突然从头上被人搭话，眼睛瞬间抬头看。

突然，头顶传来一个声音，她眨了眨眼抬起头。"
"01a_01200.bin.json:27","01200:027","不知什么时候，前排的同学春日站在桌子旁，皱起眉头，担心地凝视着我。","01200:027","
不知不觉间，坐在前面的同班同学春日同学站在我的桌子旁边，皱着眉头担心地看着我。

不知什么时候，前面座位上的同学春日站在桌子旁，担心地皱起眉头，凝视着我。

不知何时，前排的同学春日站在桌旁，皱起眉头，担心地看着我。"
"01a_01200.bin.json:28","01200:028","春日","01200:028","
春日

春日

春日"
"01a_01200.bin.json:29","01200:029","有什么困扰的事吗？","01200:029","春日

有什么困扰的事吗？

你有什么困扰的事吗？

有什么困难吗？"
"01a_01200.bin.json:32","01200:032","咦？","01200:032","爱丽丝

咦？

诶？

呃？"
"01a_01200.bin.json:35","01200:035","虽然你的表情在疑惑我怎么会知道，但是你一坐在自己的座位上开始思考，就露出了非常烦恼的表情。我当然会注意到的。","01200:035","春日

虽然她一脸“为什么这么问？”的表情，但一坐到自己的座位上，就露出非常烦恼的表情。我发现了。

虽然脸上长着什么，但是一想到坐在自己的座位上，就露出了非常烦恼的表情。我会注意到的。

你一副为什么的表情，我刚坐到你的座位上，你就一副很烦恼的表情。你会注意到的。"
"01a_01200.bin.json:39","01200:039","“原来我的表情那么烦恼啊。”我啪嗒啪嗒地摸着自己的脸。笑着的春日温柔地把手搭在我的肩膀上。","01200:039","
我不断触摸自己的脸，心想自己的表情有这么烦恼吗？春日前辈笑逐颜开，温柔地把手搭在我肩上。

脸上突然摸到了脸，她是不是有那么烦恼的表情。破颜的春日温柔地把手搭在了肩上。

“原来你的表情那么烦恼啊。”我啪嗒啪嗒地摸着她的脸。笑着的春日温柔地把手搭在我的肩膀上。"
"01a_01200.bin.json:42","01200:042","虽然不知道在烦恼什么，但是如果你遇到什么困难的话——对了！","01200:042","春日

虽然不知道她在烦恼什么，但若有什么困扰的话——对了！

虽然不知道在烦恼什么，但是如果有什么困难的话——是的！

虽然不知道你在烦恼什么，但如果有什么困扰的话——没错！"
"01a_01200.bin.json:44","01200:044","像是想到了什么要紧的事似的，表情一下子明朗起来。","01200:044","
佐和良义前辈仿佛想到了什么，表情瞬间开朗起来。

象想到了预先准备一样地使表情明亮起来。

像是想到了什么要紧的事似的，表情一下子明朗起来。"
"01a_01200.bin.json:45","01200:045","其实最近有个传闻。既然这样，或许能解决你的烦恼！","01200:045","春日

其实最近有个传闻。既然这样，或许能解决你的烦恼！

其实最近有传闻呢。那样的话也许能解决烦恼！

其实最近有个传闻。那样的话也许能解决烦恼！"
"01a_01200.bin.json:47","01200:047","面对从天而降的幸运，我问春日是怎么回事。而她——","01200:047","
我向春日询问这突如其来的幸运是怎么回事。她——……

对于下起的幸运，春日同学问了什么。她……

面对从天而降的幸运，我问春日是什么。她是——……"
"01a_01200.bin.json:49","01200:049","——以一日千秋的心情寻找机会的我，","01200:049","
——我抱着度日如年的心情等待机会。

——怀着一天千秋的心情窥探机会的我，

——以一日千秋的心情寻找机会的我。"
"01a_01200.bin.json:50","01200:050","在班会结束的瞬间，一只手拿着包冲出了教室。","01200:050","
听见导师结束班会的瞬间，我单手拿起包包冲出教室。

在班会结束的瞬间，我一只手拿着包冲出了教室。

当听到班主任结束家庭房间的声音时，她单手拿着包从教室里跑了出来。"
"01a_01200.bin.json:54","01200:054","因为老师的讲话太长，走廊里已经有别的班的学生们了，其中——","01200:054","
因为老师讲话太长，走廊上出现了别班的学生，其中——……

因为老师说话很长，走廊里有别的班的学生们，其中有……

因为老师说话太长，走廊里出现了其他班级的学生，其中——……"
"01a_01200.bin.json:56","01200:056","小明！","01200:056","爱丽丝

小明！

小明！

小明！"
"01a_01200.bin.json:59","01200:059","抱着尴尬心情的童年好友，本来打算第一个回去，已经在电梯口拿起了自己的鞋子。","01200:059","
我猜得没错，这个心情很尴尬的发小，果然打算第一个回家，她已经在鞋柜区拿起自己的鞋子了。

抱着尴尬心情的发小，预想会以最棒的速度回去，已经在电梯口拿到了自己的鞋子。

原本以为那个心情尴尬的童年玩伴会第一个回家，没想到她已经在电梯门口拿起了自己的鞋子。"
"01a_01200.bin.json:60","01200:060","再次呼唤她的名字，跑到童年好友身边。","01200:060","
我再次呼唤她的名字，回到发小身边。

再一次呼唤名字，回到发小的身边。

再次呼唤她的名字，回到发小身边。"
"01a_01200.bin.json:62","01200:062","小明","01200:062","
小明

小明

小明"
"01a_01200.bin.json:63","01200:063","啊，怎么了——哇！？","01200:063","小明

哎，怎么了——哇哇！？

啊，怎么办——哇！？

啊，怎么了——哇！？"
"01a_01200.bin.json:65","01200:065","——跟我过来！","01200:065","
——陪我！

——交往吧！

——跟我交往！"
"01a_01200.bin.json:66","01200:066","说完，我拿起自己的鞋子，飞快地穿好，牵着小明的手快步走了。","01200:066","
我这么宣言，拿起自己的鞋子迅速穿上，然后牵起小明的手快步前进。

说完，她拿起自己的鞋子，飞快地穿好，牵着小明的手快步走了。

这样宣言，拿着自己的鞋，快速地穿完后，牵着小明的手快步走了。"
"01a_01200.bin.json:71","01200:071","意气轩昂、大步奔向目的地的我什么都听不进去。","01200:071","
我意气风发地大步走向目的地，所以没有听见。

意气轩昂、大步奔向目的地的我根本听不进去。

我没有听到气宇轩昂地大踏步走向目的地的我。"
"01a_01200.bin.json:72","01200:072","因为找到了应该去的能量的前方而兴奋。所以，","01200:072","
因为我找到该朝向何方前进，所以很兴奋。所以——

因为我很兴奋发现了应该去的能量的前方。所以

因为找到了应该去的能量的前方而兴奋。所以，"
"01a_01200.bin.json:74","01200:074","爱丽丝！","01200:074","小明

爱丽丝！

爱丽丝！

爱丽丝！"
"01a_01200.bin.json:78","01200:078","任由我摆布的小明停了下来，缩回了手，我这才发现她叫了我好几次。","01200:078","
我任凭摆布地停下脚步，小明反而折返回头，这才发现她已经呼唤我好几次了。

任由她摆布的小明停了下来，反而把手折了回来，这才发现她叫了我好几次。

一直被她牵着鼻子走的小明停了下来，反回头一看才发现她叫了我好几次。"
"01a_01200.bin.json:80","01200:080","终于停下来了……！怎么了爱丽丝，脸色都变了。","01200:080","小明

终于停下脚步……！怎么了，爱丽丝？脸色这么难看。

终于停下来了……！怎么了爱丽丝，改变了脸色。

终于停下来了……！怎么了爱丽丝，脸色都变了。"
"01a_01200.bin.json:83","01200:083","诶，咦？我没有说明吗？","01200:083","爱丽丝

咦，奇怪？我不是解释过了吗？

咦，那个？没有说明吗？

诶，咦？没有说明吗？"
"01a_01200.bin.json:86","01200:086","她无奈地摇着头。我与她牵着的手摇晃着，这时才意识到我紧紧握着她的手，感到脸颊一阵发热。久违的好友之手。","01200:086","
我无奈地摇摇头。牵着的手晃了晃，我这才发现我们一直紧紧握着彼此的手，顿时感到脸颊发烫。好久没牵挚友的手。

她无奈地摇着头。牵着的手摇晃着，这时才意识到紧紧握着的事实，感到脸颊一阵发热。久违了的挚友的手。

摇头作祟现在才发现连接着的手在那里牢牢握着的事实，脸突然热起来。久违的好友之手。"
"01a_01200.bin.json:88","01200:088","呃，那个，我找到可以解开大家对小明的误会的方法了！","01200:088","爱丽丝

呃，那个，我找到可以解开大家对小明的误会的方法了！

嗯，找到了解决对小明误解的方法！

嗯，我找到了解除对小明误解的方法！"
"01a_01200.bin.json:91","01200:091","误会？啊啊……","01200:091","小明

误会？啊啊……

误解？啊……

误解？啊……"
"01a_01200.bin.json:94","01200:094","她一下子失去了兴趣，脸上露出不高兴的样子。那表情就像一只吃到一半时盘子中途被人拿走的猫。","01200:094","
表情一下子失去兴趣。露出不悦的表情。她的表情就像吃到一半的盘子被抢走的猫。

兴趣一下子从脸上消失了。露出不高兴的表情。那表情就像一只吃到一半的盘子中途被人拿走的猫。

一下子失去了兴趣。脸上露出不高兴的样子。脸上像是中途被拿走了刚吃完的盘子的猫一样。"
"01a_01200.bin.json:96","01200:096","我挥动着牵着的手，大喊：“我听到了好消息！”","01200:096","
我甩开她的手，告诉她我听到一个好消息！她这么喊。

我挥着牵着手，听了好话！这样喊着。

我挥动着牵着我的手，听到了好消息！大叫道。"
"01a_01200.bin.json:98","01200:098","从同学那里听说，这个学校有很厉害的占卜师！","01200:098","爱丽丝

我从同班同学那里听说，这所学校有个很厉害的占卜师！

从同学那里听说这个学校有很厉害的占卜师！

我听同学说，这个学校里有个很厉害的占卜师！"
"01a_01200.bin.json:100","01200:100","占卜师？占卜就是恋爱运什么的，或者往这个方向走会有好运什么的吧。和误解有什么关系呢？","01200:100","小明

占卜师？占卜不就是算恋爱运或走哪个方向会幸运之类的吗？所以为什么变成要解开误会？

占卜师？占卜是恋爱运或者朝着这个方向走的话会有幸运的吧。那么为什么会说误解呢？

占卜师？占卜就是恋爱运什么的，往这个方向走会有好运什么的。那为什么要消除误会呢？"
"01a_01200.bin.json:103","01200:103","那个占卜师会把谜团一闪地猜中哦！","01200:103","爱丽丝

因为那位占卜师同学完全说中了谜底！

那个占卜师会把谜团一闪地猜到哦！

因为那个占卜师完全猜中了谜题哦！"
"01a_01200.bin.json:105","01200:105","每当我兴奋的时候，小明的表情就会变得正相反地枯萎了。这是为什么？","01200:105","
每当我很兴奋的时候，小明的表情就会反比例地逐渐消沉。”为什么？

每当我兴奋时，小明的表情就会反比地萎靡不振。为什么？

每当我兴奋时，小明的表情就会成反比地萎缩。为什么？"
"01a_01200.bin.json:107","01200:107","找失物什么的占卜师还懂，这次的事是在找犯人吧？差不多就像是那样吧？","01200:107","小明

如果是找东西，占卜师还知道，但这次是要找犯人吧？那个是指，她们两个很像，却又不太像？

找失物什么的占卜师还懂，这次的事是在找犯人吧？这不是很像吗？

如果是寻找失物的话，占卜师是知道的，但是这次的事情是找犯人吧？那个好像很像，没错吧？"
"01a_01200.bin.json:109","01200:109","是吗……是吗？但是，班上的同学说，她就像传说一样什么都猜中了，全部猜中哦！","01200:109","爱丽丝

没错……是吗？但是，班上的女生真的什么都能猜中，什么都能猜中哦！

是的……是吗？但是，班上的孩子什么都猜中了，什么都可以！

是吗……是吗？但是，班上的同学就像传说的那样什么都能猜对，什么都能猜！"
"01a_01200.bin.json:112","01200:112","全部吗……","01200:112","小明

什么都可以……

为什么……

为什么……"
"01a_01200.bin.json:114","01200:114","她把眉毛做成一个字，凝住我的眼睛，凝视着什么记号。然后，","01200:114","
她垂下眉尾，凝视着我的双眼，像是在寻找什么印记。然后，

我把眉毛做成一个字，凝住我的眼睛，凝视着什么记号。然后

她皱起眉头，盯着我的眼睛，仿佛在寻找什么记号。然后，"
"01a_01200.bin.json:116","01200:116","……[#]呵呵，哈哈！","01200:116","小明

……[#]呵呵，哈哈！

……[#]呵呵，哈哈！

……[#]呵呵，哈哈！"
"01a_01200.bin.json:118","01200:118","嗯？","01200:118","爱丽丝

嗯？

嗯？

嗯？"
"01a_01200.bin.json:121","01200:121","不，嘛，爱丽丝这么推荐给我的占卜师，犯人也可能会知道吧。……虽然因为担心我才提出的建议。","01200:121","小明

呃，毕竟爱丽丝那么推崇那位占卜师，或许她真的会知道犯人是谁……毕竟她是顾虑到我，才这么提议。

不，嘛，爱丽丝就是这么推荐的占卜师，犯人也可能会知道吧。……因为担心我才提出的建议。

不，反正爱丽丝是这么推荐我的占卜师，说不定会知道犯人是谁。……她是考虑到我才提出来的。"
"01a_01200.bin.json:124","01200:124","“有什么关系嘛，去问问看！”我轻轻地挥着牵着的手。小明好像也觉得这是个好主意，我也很高兴。","01200:124","
好啊，就听听看吧！她用力挥动牵着的手。小明似乎也觉得这是个好主意，我也很高兴。

好啊，问问看！轻轻地挥着牵着的手。小明好像也觉得这是个好主意，我也很高兴。

好啊，问问看！的手嗡嗡地挥动着。小明也觉得这是个好主意，我也很高兴。"
"01a_01200.bin.json:125","01200:125","那我们去茶道部吧！","01200:125","爱丽丝

那我们去茶道部吧！

那么去茶道部吧！

那就去茶道部吧！"
"01a_01200.bin.json:127","01200:127","嗯？等、等一下！为什么是茶道部！？","01200:127","小明

嗯？等、等一下！为什么是茶道部！？

嗯？等一下！为什么是茶道部？

？等、等一下！为什么是茶道部！？"
"01a_01200.bin.json:131","01200:131","不，虽然你脸上好像在说“说什么鬼话”，但这话应该是我应该说的吧？","01200:131","小明

不对，虽然你一脸“你在说什么鬼话”的表情，但想说这句话的人是我哦。

不，虽然脸上说了什么奇怪的话，但是想这么说的是我吧？

不，你看起来好像在说什么奇怪的话，其实想这么说的是我吧？"
"01a_01200.bin.json:133","01200:133","因为要去见占卜师耶？","01200:133","爱丽丝

因为要去见占卜师耶？

因为要去见占卜师哦？

因为你要去找占卜师啊。"
"01a_01200.bin.json:136","01200:136","听了我坦率的话，小明不知为何眯起眼睛瞪着我脑袋的斜后方。","01200:136","
我直率地说出这些话后，小明不知为何眯起眼睛，瞪着我头的斜后方。

听了我的坦率，小明不知为何眯起眼睛瞪着我的斜后方。

面对我坦率的话语，小明不知为何眯着眼睛盯着我的头的斜后方。"
"01a_01200.bin.json:137","01200:137","我回头一看，秋天的天空中，只有一朵小小的云，飘浮在半空中。就像用钉子牢牢钉死的舞台装置云朵一样。","01200:137","
我回头一看，秋天的天空中，只有一朵小小的云，飘浮在半空中。就像用钉子牢牢钉死的舞台装置云朵一样。

回头一看，秋天的天空中只有一朵小小的坚硬的云浮起。就像被钉子牢牢钉住的舞台装置的云一样。

回头一看，秋天的天空中只飘浮着一朵坚硬的小云。就像被钉子牢牢钉住的舞台装置上的云一样。"
"01a_01200.bin.json:139","01200:139","——难道占卜师是茶道部的人来当的吗？","01200:139","小明

——该不会占卜师是茶道部的人在当。

——难道占卜师是茶道部的人做的吗？

——占卜师是茶道部的人做的吗？"
"01a_01200.bin.json:142","01200:142","是啊？","01200:142","爱丽丝

是啊？

是啊？

是啊？"
"01a_01200.bin.json:145","01200:145","……[#]是吗？我以为会去占卜研究会之类的地方，但是竟然是茶道部的人。","01200:145","小明

……[#]这样啊。我本来以为要去占卜研究会之类的地方，结果是茶道部的人啊。”

……[#]是吗。我以为会去占卜研究会之类的地方，但是没有茶道部的人。

……[#]是吗？我还以为是去占卜研究会之类的地方，没想到是茶道部的人。"
"01a_01200.bin.json:147","01200:147","小明低声嘟囔着什么。我拉起她的手，“走吧！”一起前进了。","01200:147","
小明不知道在喃喃自语些什么，我牵起她的手，说：“那我们走吧！”她迈开步伐。

拉着嘟囔着什么的小明的手，走吧！这样前进了。

小明嘀咕着什么，我拉起她的手说：那我们走吧！向前走了一步。"
"01a_01200.bin.json:149","01200:149","同班同学告诉我的茶道部地点，似乎是在操场后方，如宅邸般零星分布的社团大楼之一。","01200:149","
同班同学告诉我的茶道部地点，似乎是在操场后方，如宅邸般零星分布的社团大楼之一。

听同班同学说，茶道部的地点是在操场后面像宅邸一样散布的社团大楼里。

从同学那里听说茶道部的地方，好像是运动场里面像宅邸一样散布的社团活动楼之一。"
"01a_01200.bin.json:150","01200:150","沿着她们告诉我的道路前进，有一条铺路。杜鹃的篱笆在道路一侧一直延伸着。到了五月应该会呈现出美丽的景象吧。","01200:150","
照着指示前进后，我们来到一条经过铺设的小路，路旁有一整排沿着道路生长的杜鹃花篱笆。到了五月，应该就能展现出美丽的姿态了吧。

沿着您告诉我的道路前进，有一条铺路，只有一边沿着道路，杜鹃的篱笆一直持续着。到了五月，会给我们看美丽的样子吧。

按照她告诉的方向往前走，有一条铺着柏油的小道路，只有一侧沿着道路延伸着杜鹃花树篱。到了五月应该会呈现出美丽的景象吧。"
"01a_01200.bin.json:151","01200:151","沿着杜鹃花树篱往前走，有一处种了很多山茶花的地方。按照她们告诉的方向朝山茶花走去。这时，","01200:151","
我一边侧眼看着杜鹃花篱笆，一边走着，看到有地方种植了整理过的山茶花。我按照椿的指示，朝她前进。这时候。

沿着杜鹃花树篱往前走，有一处山茶花被集中种植。按照她告诉的方向朝椿走去。和，

一边斜着看杜鹃花的篱笆，一边有一个地方是把山茶集中起来种的。正如你告诉我的那样，我朝着椿前进。单击功能区上"
"01a_01200.bin.json:152","01200:152","真的存在……！","01200:152","爱丽丝

真的存在……！

真的有……！

真的有……！"
"01a_01200.bin.json:154","01200:154","眼前豁然开朗，被红叶的红色与银杏、唐松的金黄色包围的古民家出现在眼前。","01200:154","
眼前豁然开朗，被红叶的红色与银杏、唐松的金黄色包围的古民家出现在眼前。

眼前一片开，出现了红叶的朱红色和被银杏和唐松的金黄色包围的古民家。

眼前豁然开朗，出现了一座被红枫和银杏、唐松的金黄色包裹的古民居。"
"01a_01200.bin.json:155","01200:155","这是茶室吗……？","01200:155","爱丽丝

这是茶室吗……？

这是茶室吗……？

这就是茶室吧……？"
"01a_01200.bin.json:157","01200:157","我走在古民家风格的房屋周围，找到像是入口的地方。","01200:157","
我走在古民家风格的房屋周围，找到像是入口的地方。

走在古民家建筑的周围，发现了类似入口的地方。

绕着古民居走了一圈，终于找到了入口。"
"01a_01200.bin.json:158","01200:158","在白色细砂与蓝色踏脚石的前方，有个必须弯下腰才能钻进去的入口。","01200:158","
在白色细砂与蓝色踏脚石的前方，有个必须弯下腰才能钻进去的入口。

白色的碎石子和蓝色的踏脚石的前方，有一个弯着腰才能进去的入口。

白色的玉石和蓝色的踏石的前面，有一个可以屈膝爬进去的入口。"
"01a_01200.bin.json:159","01200:159","就像在电影里看到的那样小巧的入口，“真的是这样啊”，我停下脚步，目不转睛地看了进去。","01200:159","
看到和电影里一样小巧的入口，我心想原来真的是这样，停下脚步，目不转睛地盯着看。

就像在电影里看到的那样小巧的入口，真的是这样啊，我停下脚步，目不转睛地看了进去。

在电影中看到的那样小巧的入口，真的是这样的，我停下脚步真的看进去了。"
