"location","source","target","id","developer_comments"
"01a_03500.bin.json:189","03500:189","比昨天、比早上，更用力地抓住胸口、抓住胸口深处。","03500:189","
比昨天、比早上，更用力地抓住胸口、抓住胸口深处。

比昨天、比早上更用力地握住了我的胸口，我的内心深处被老鹰紧紧地握住了。

比起昨天，比早上，我的胸要更强，紧紧抓住我的内心。"
"01a_03500.bin.json:190","03500:190","这份感情是……？","03500:190","
这份感情是……？

这种感情……？

这种感情……？"
"01a_03500.bin.json:191","03500:191","——穗高明拯救了在学校格格不入的我。","03500:191","
——穗高明拯救了在学校格格不入的我。

穗高明拯救了在学校漂浮的我。

——穗高明拯救了在学校浮着的我。"
"01a_03500.bin.json:192","03500:192","接受并认同现在的我的佐和良义宝珠——","03500:192","
接受并认同现在的我的佐和良义宝珠——

接受了现在的我并认可了的佐和良义宝珠——

接受并认可了现在的我的佐和良义宝珠——"
"01a_03500.bin.json:193","03500:193","我感到痛苦的是——","03500:193","
我感到痛苦的是——……

我痛苦的是——……

我痛苦的是——……"
"01a_03500.bin.json:195","03500:195","啊，爱丽丝！这里、这里！","03500:195","小明

啊，爱丽丝！这里、这里！

啊，爱丽丝！这边，这边！

啊，爱丽丝！这边，这边！"
"01a_03500.bin.json:197","03500:197","我向紧张的表情突然放松，开朗挥手的发小也举手回应。","03500:197","
我向紧张的表情突然放松，开朗挥手的发小也举手回应。

我也举手给紧张的脸一下子缓和下来，开朗地挥手的发小。

紧张的表情一下子缓和下来，我也向开朗地挥手的童年玩伴举起了手。"
"01a_03500.bin.json:198","03500:198","宝珠前辈以柔和的眼神注视着自己，那双眼睛不是绯红之眼，这让哮内心深处松了口大气，同时走向座位……","03500:198","
宝珠前辈以柔和的眼神注视着自己，那双眼睛不是绯红之眼，这让哮内心深处松了口大气，同时走向座位……

宝珠前辈用柔和的目光凝视着我，我在内心深处感到安心，她的眼睛不是红色的，我走向座位……

宝珠前辈用温柔的目光注视着，因为不是绯的眼睛，所以在内心深处放心地走向了座位……"
